Label,Title,Poet,Poem,Tags,Poem_word_count,Poem_char_count
death,Spring A. D.,George Seferis,"Again with spring she wore light colours and with gentle steps again with spring again in summer she was smiling. Among fresh blossoms breast naked to the veins beyond the dry night beyond the white old men debating quietly whether it would be better to give up the keys or to pull the rope and hang from the noose to leave empty bodies there where souls couldn’t endure there where the mind couldn’t catch up and knees buckled. With the new blossoms the old men failed and gave up on everything grandchildren and great-grandchildren the broad fields the green mountains love and life compassion and shelter rivers and sea; and they departed like statues leaving behind a silence that no sword could cut that no gallop could break nor the voices of the young; and the great loneliness came the great privation along with this spring and settled and spread like the frost of dawn caught hold of the high branches slid down the trunks of trees and wrapped around our soul. But she smiled wearing light colours like a blossoming almond tree in yellow flames and walked along lightly opening windows in the delighted sky without us the luckless ones. And I saw her breast naked the waist and the knee, as the inviolate martyr inviolate and pure issues from the torment to go to heaven, beyond the inexplicable whispering of people in the boundless circus beyond the black grimace the sweaty neck of the exasperated executioner striking vainly. The loneliness now a lake the privation now a lake untouched and untraceable. 16 March ’39","['living', 'death', 'growing old', 'time & brevity', 'nature', 'spring', 'summer']",266,1530
death,Last Words by “Slick”,Etheridge Knight,"(or a self / sung eulogy) Now, when I / die, dont you bury me On no lone prairie; And dont put me in no plain pine box (cause I left plenty cold cash!); And throw my cold butt in the deep blue see. Whatever you do, dont plant me / in no six feet of dirt; Just mash me, mash me, except for my dick, Which I want wrapped in a white / woman’s skirt. I dont want no preacher / man a-preaching Over me—cause I know where I am going. I dont want no tears, no flowers, No standing around and waiting / up / all hours. Just get a golden trumpet, and have Dizzy blow it. Cause I / wuz / Slick—and you damn well know it. No piano playing, no blues please; No moaning and groaning; Just lay me on the table, mash me Into my two-hundred-dollar suit, Red socks, black patent leather shoes, Polka-dot tie (make damn sure it’s silk— And dont forget it!) Take me out to my pink cadillac Prop me up / under the steering wheel, Tow me out to real high hill, Dig a hole—twenty feet long and twenty feet wide, Place a giant joint of reefer / weed by my side; Then leave me alone— And let me drive to hell in style!","['living', 'death', 'sorrow & grieving']",223,1094
death,Confession,Norman Dubie,"for Hank The General’s men sit at the door. Her eyes Are fat with belladonna. She’s naked Except for the small painted turtles That are drinking a flammable cloud Of rum and milk from her navel. The ships out in the harbor Are loosely allied Like casks floating in bilge. The occasional light on a ship Winks. In the empty room of the manuscript Someone is grooming you For the long entrance into the dark city. They’ll hang the General. Then with torches they’ll search for his children. Men and women Are seen jumping from the burning hotel. Journalists, in no hurry, Elect to take the elevator. They walk Out of the building, stepping over corpses. . . You are listening to loud bells. The corpses get up and follow the journalists. It’s unfair that while rehearsing For death they actually succumbed to it. But no one sobs. Shirts and dresses billowing as they fall. Something inhuman in you watched it all. And whatever it is that watches, It has kept you from loneliness like a mob.","['living', 'death', 'social commentaries', 'war & conflict']",177,988
death,Forever and a Day,Samuel Menashe,No more than that Dead cat shall I Escape the corpse I kept in shape For the day off Immortals take,"['living', 'death']",21,99
death,Twilight Blues,Samuel Menashe,"(Morton St. Pier) Lying here Flat on my back I can almost see Myself in the morgue On a slab, tagged I am the corpse No one will have Not stabbed, stored No one takes my life It goes by the board","['living', 'death', 'the body', 'time & brevity', 'nature']",42,195
death,The Visitation,Samuel Menashe,"His body ahead Of him on the bed He faces his feet Sees himself dead, A corpse complete With legs and chest And belly between Swelling the scene Of the crime you left, Taking your time, Angel of Death","['living', 'death', 'growing old', 'the body', 'nature']",39,200
death,Cancer and Complaint at Midsummer,C. Dale Young,"Because the silence of the dead, that blue expanse of sky about to ashen here above my head, is easily ignored, our tears are blamed on flowers whitening limbs of trees, the very air, with hymns of summer pollen no one hears except for women—old, devout. And now, these humid months, dispute them not: midsummer has no name among the dead, no Latin root to which it can be traced, no swarm of conjugations to decipher. So little left to write this summer, my mind now weak in handling form, which I still cling to just the same.","['living', 'death', 'health & illness', 'arts & sciences', 'poetry & poets']",98,528
death,At the Moment,Joyce Sutphen,"Suddenly, I stopped thinking about Love, after so many years of only that, after thinking that nothing else mattered. And what was I thinking of when I stopped thinking about Love? Death, of course—what else could take Love’s place? What else could hold such force? I thought about how far away Death once had seemed, how unexpected that it could happen to someone I knew quite well, how impossible that this should be the normal thing, as natural as frost and winter. I thought about the way we’d aged, how skin fell into wrinkles, how eyes grew dim; then (of course) my love, I thought of you.","['living', 'death', 'growing old']",107,595
death,Ghetto Funeral,Charles Reznikoff,"Followed by his lodge, shabby men stumbling over the cobblestones, and his children, faces red and ugly with tears, eyes and eyelids red, in the black coffin in the black hearse the old man. No longer secretly grieving that his children are not strong enough to go the way he wanted to go and was not strong enough.","['living', 'death']",58,315
death,An Instrument Also,Donald Revell,"The climate thinks with its knees. When the wound opens, music suspires. Opening a gate, I gain the color below the roof tiles and the tree limbs. You gave me the late quartets a black bird and a white and the Garden of Eden. Your death belongs to anyone but me. I wonder so as not to forget. At night in Brooklyn, the tendrils of a white sex denuded the sky, shimmering at the tall needle- ends of buildings. The traffic was identical in the spring. I am protected by only music I cannot remember. Why is it that the best minds ended by composing fairy tales? Death swarms. There are many new beings, the odor of hearts. The order of the hour of mating ends. These are many new butterflies, and death is no longer to be eyed by a young girl, perhaps twelve years old, slyly, as though the future were a man’s sleeve or stride. I wonder so as not to end dinner in a farmhouse. We sat at a low table. Our host was dying but unaware, as she would be murdered the next day in a distant city. There is an out- side of language that is not silence. There is an outside of God that is not isolation, a domestic animal teaching a dying woman to hunt. A wound opens. A gate opens. Tendrils climb.","['living', 'death']",231,1188
death,How many times these low feet staggered (238),Emily Dickinson,How many times these low feet staggered - Only the soldered mouth can tell - Try - can you stir the awful rivet - Try - can you lift the hasps of steel! Stroke the cool forehead - hot so often - Lift - if you care - the listless hair - Handle the adamantine fingers Never a thimble - more - shall wear - Buzz the dull flies - on the chamber window - Brave - shines the sun through the freckled pane - Fearless - the cobweb swings from the ceiling - Indolent Housewife - in Daisies - lain!,"['living', 'death']",101,488
death,Dragging the Lake,Thomas James,"They are skimming the lake with wooden hooks. Where the oak throws its handful of shadows Children are gathering fireflies. I wait in the deep olive flux As their cries ricochet out of the dark. Lights spear the water. I hear the oak speak. It foists its mouthful of sibilants On a sky involved with a stillborn moon, On the stock-still cottages. I lean Into the dark. On tiny splints, One trellised rose is folding back Its shawls. The beacon strikes the lake. Rowboats bob on the thick dark Over my head. My fingers wave Goodbye, remember me. I love This cold, these captive stars. I shake My blanket of shadows. I breathe in: Dark replenishes my two wineskins. My eyes are huge, two washed-out mollusks. Oars fall, a shower of violet spray. When will my hosts deliver me, Tearing me with their wooden hooks? Lights flicker where my live heart kicked. I taste pine gum, they have me hooked. They reel me in, a displaced anchor. The cygnets scatter. I rise, I nod, Wrapped in a jacket of dark weed. I dangle, I am growing pure, I fester on this wooden prong. An angry nail is in my tongue.","['living', 'death', 'mythology & folklore', 'horror']",200,1090
death,Anne Rutledge,Edgar Lee Masters,"Out of me unworthy and unknown The vibrations of deathless music; “With malice toward none, with charity for all.” Out of me the forgiveness of millions toward millions, And the beneficent face of a nation Shining with justice and truth. I am Anne Rutledge who sleep beneath these weeds, Beloved in life of Abraham Lincoln, Wedded to him, not through union, But through separation. Bloom forever, O Republic, From the dust of my bosom!","['living', 'death', 'social commentaries', 'heroes & patriotism']",74,435
death,Cool Tombs,Carl Sandburg,"When Abraham Lincoln was shoveled into the tombs, he forgot the copperheads and the assassin ... in the dust, in the cool tombs. And Ulysses Grant lost all thought of con men and Wall Street, cash and collateral turned ashes ... in the dust, in the cool tombs. Pocahontas’ body, lovely as a poplar, sweet as a red haw in November or a pawpaw in May, did she wonder? does she remember? ... in the dust, in the cool tombs? Take any streetful of people buying clothes and groceries, cheering a hero or throwing confetti and blowing tin horns ... tell me if the lovers are losers ... tell me if any get more than the lovers ... in the dust ... in the cool tombs.","['living', 'death', 'time & brevity', 'social commentaries', 'history & politics']",126,658
death,The Last Laugh,Wilfred Owen,"‘O Jesus Christ! I’m hit,’ he said; and died. Whether he vainly cursed or prayed indeed, The Bullets chirped—In vain, vain, vain! Machine-guns chuckled—Tut-tut! Tut-tut! And the Big Gun guffawed. Another sighed,—‘O Mother,—mother,—Dad!’ Then smiled at nothing, childlike, being dead. And the lofty Shrapnel-cloud Leisurely gestured,—Fool! And the splinters spat, and tittered.‘My Love!’ one moaned. Love-languid seemed his mood, Till slowly lowered, his whole face kissed the mud. And the Bayonets’ long teeth grinned; Rabbles of Shells hooted and groaned; And the Gas hissed.","['living', 'death', 'sorrow & grieving', 'social commentaries', 'war & conflict']",84,576
death,Come Up from the Fields Father,Walt Whitman,"Come up from the fields father, here’s a letter from our Pete, And come to the front door mother, here’s a letter from thy dear son. Lo, ’tis autumn, Lo, where the trees, deeper green, yellower and redder, Cool and sweeten Ohio’s villages with leaves fluttering in the moderate wind, Where apples ripe in the orchards hang and grapes on the trellis’d vines, (Smell you the smell of the grapes on the vines? Smell you the buckwheat where the bees were lately buzzing?) Above all, lo, the sky so calm, so transparent after the rain, and with wondrous clouds, Below too, all calm, all vital and beautiful, and the farm prospers well. Down in the fields all prospers well, But now from the fields come father, come at the daughter’s call, And come to the entry mother, to the front door come right away. Fast as she can she hurries, something ominous, her steps trembling, She does not tarry to smooth her hair nor adjust her cap. Open the envelope quickly, O this is not our son’s writing, yet his name is sign’d, O a strange hand writes for our dear son, O stricken mother’s soul! All swims before her eyes, flashes with black, she catches the main words only, Sentences broken, gunshot wound in the breast, cavalry skirmish, taken to hospital, At present low, but will soon be better.","['living', 'death', 'sorrow & grieving', 'social commentaries', 'war & conflict']",230,1283
death,Song of Myself: 36,Walt Whitman,"Stretch’d and still lies the midnight, Two great hulls motionless on the breast of the darkness, Our vessel riddled and slowly sinking, preparations to pass to the one we have conquer’d, The captain on the quarter-deck coldly giving his orders through a countenance white as a sheet, Near by the corpse of the child that serv’d in the cabin, The dead face of an old salt with long white hair and carefully curl’d whiskers, The flames spite of all that can be done flickering aloft and below, The husky voices of the two or three officers yet fit for duty, Formless stacks of bodies and bodies by themselves, dabs of flesh upon the masts and spars, Cut of cordage, dangle of rigging, slight shock of the soothe of waves, Black and impassive guns, litter of powder-parcels, strong scent, A few large stars overhead, silent and mournful shining, Delicate sniffs of sea-breeze, smells of sedgy grass and fields by the shore, death-messages given in charge to survivors, The hiss of the surgeon’s knife, the gnawing teeth of his saw, Wheeze, cluck, swash of falling blood, short wild scream, and long, dull, tapering groan, These so, these irretrievable.","['living', 'death', 'the body', 'nature', 'social commentaries', 'war & conflict']",196,1149
death,the rites for Cousin Vit,Gwendolyn Brooks,"Carried her unprotesting out the door. Kicked back the casket-stand. But it can't hold her, That stuff and satin aiming to enfold her, The lid's contrition nor the bolts before. Oh oh. Too much. Too much. Even now, surmise, She rises in the sunshine. There she goes, Back to the bars she knew and the repose In love-rooms and the things in people's eyes. Too vital and too squeaking. Must emerge. Even now she does the snake-hips with a hiss, Slops the bad wine across her shantung, talks Of pregnancy, guitars and bridgework, walks In parks or alleys, comes haply on the verge Of happiness, haply hysterics. Is.","['living', 'death', 'family & ancestors']",108,612
death,Experience,Edith Wharton,"I Like Crusoe with the bootless gold we stand Upon the desert verge of death, and say: “What shall avail the woes of yesterday To buy to-morrow’s wisdom, in the land Whose currency is strange unto our hand? In life’s small market they had served to pay Some late-found rapture, could we but delay Till Time hath matched our means to our demand.” But otherwise Fate wills it, for, behold, Our gathered strength of individual pain, When Time’s long alchemy hath made it gold, Dies with us—hoarded all these years in vain, Since those that might be heir to it the mould Renew, and coin themselves new griefs again. II O Death, we come full-handed to thy gate, Rich with strange burden of the mingled years, Gains and renunciations, mirth and tears, And love’s oblivion, and remembering hate, Nor know we what compulsion laid such freight Upon our souls—and shall our hopes and fears Buy nothing of thee, Death? Behold our wares, And sell us the one joy for which we wait. Had we lived longer, like had such for sale, With the last coin of sorrow purchased cheap, But now we stand before thy shadowy pale, And all our longings lie within thy keep— Death, can it be the years shall naught avail? “Not so,” Death answered, “they shall purchase sleep.”","['living', 'death', 'time & brevity']",222,1245
death,Death of an Infant,Lydia Huntley Sigourney,"Death found strange beauty on that cherub brow, And dash’d it out. – There was a tint of rose O’er cheek and lip; – he touch’d the veins with ice, And the rose faded. – Forth from those blue eyes There spake a wistful tenderness, – a doubt Whether to grieve or sleep, which Innocence Alone can wear. – With ruthless haste he bound The silken fringes of their curtaining lids Forever. – There had been a murmuring sound With which the babe would claim its mother’s ear, Charming her even to tears. – The spoiler set His seal of silence. – But there beam’d a smile, So fix’d and holy from that marble brow, –Death gazed and left it there; – he dared not steal The signet-ring of Heaven.","['living', 'death', 'infancy', 'sorrow & grieving']",130,684
death,Let Me Die on the Prairie,Frances Jane Crosby Van Alstyne,"Let me die on the prairie! and o’er my rude grave, In the soft breeze of summer the tall grass shall wave; I would breathe my last sigh as the bright hues of even Are melting away in the blue arch of Heaven. Let me die on the prairie! unwept and unknown, I would pass from this fair Earth forgotten, alone;—Yet no! – there are hearts I have learned to revere, And methinks there is bliss in affection’s warm tear. Oh, speak not to me of the green cypress shade; I would sleep where the bones of the Indian are laid, And the deer will bound o’er me with step light and free, And the carol of birds will my requiem be. Let me die on the prairie! I have wished for it long; There floats in wild numbers the bold hunter’s song; ’Tis the spot of all others the dearest to me, And how sweet in its bosom my slumber will be!","['living', 'death', 'nature', 'landscapes & pastorals']",163,817
death,My Grave,Ella Wheeler Wilcox,"If, when I die, I must be buried, let No cemetery engulph me — no lone grot, Where the great palpitating world comes not, Save when, with heart bowed down and eyelids wet, It pays its last sad melancholy debt To some outjourneying pilgrim. May my lot Be rather to lie in some much-used spot, Where human life, with all its noise and fret, Throbs on about me. Let the roll of wheels, With all earth’s sounds of pleasure, commerce, love, And rush of hurrying feet surge o’er my head. Even in my grave I shall be one who feels Close kinship with the pulsing world above; And too deep silence would distress me, dead.","['living', 'death', 'funerals']",115,613
death,The Sun-Struck Eagle,Eleanor Percy Lee,"I saw an eagle sweep to the sky— The Godlike! – seeking his place on high, With a strong, and wild, and rapid wing—A dark, and yet a dazzling thing; And his arching neck, his bristling crest, And the dark plumes quivering upon his breast; And his eye, bent up to each beam of light, Like a bright sword flash’d with a sword in fight. I saw him rise o’er the forest trees; I saw his pinion ride the breeze; Beyond the clouds I watched him tower On his path of pride – his flight of power. I watched him wheeling, stern and lone, Where the keenest ray of the sun was thrown; Soaring, circling – bathed in light: Such was that desert eagle’s flight. Suddenly, then, to my straining eye, I saw the strong wing slack on high; Falling, falling to earth once more; The dark breast covered with foam and gore; The dark eyes’ glory dim with pain; Sick to death with a sun-struck brain! Reeling down from that height divine, Eagle of heaven! such fall was thine! Even so we see the sons of light, Up to the day-beam steer their flight; And the wing of genius cleaves the sky, As the clouds rush on when the winds are high: Then comes the hour of sudden dread— Then is the blasting sunlight shed; And the gifted fall in their agony, Sund-struck eagle! to die like thee!","['living', 'death', 'pets', 'nature', 'animals']",239,1258
death,Telling the Bees,Lizette Woodworth Reese,"A Colonial Custom Bathsheba came out to the sun, Out to our wallèd cherry-trees; The tears adown her cheek did run, Bathsheba standing in the sun, Telling the bees. My mother had that moment died; Unknowing, sped I to the trees, And plucked Bathsheba’s hand aside; Then caught the name that there she cried Telling the bees. Her look I never can forget, I that held sobbing to her knees; The cherry-boughs above us met; I think I see Bathsheba yet Telling the bees.","['living', 'death', 'sorrow & grieving']",84,465
death,The End,Mark Strand,"Not every man knows what he shall sing at the end, Watching the pier as the ship sails away, or what it will seem like When he’s held by the sea’s roar, motionless, there at the end, Or what he shall hope for once it is clear that he’ll never go back. When the time has passed to prune the rose or caress the cat, When the sunset torching the lawn and the full moon icing it down No longer appear, not every man knows what he’ll discover instead. When the weight of the past leans against nothing, and the sky Is no more than remembered light, and the stories of cirrus And cumulus come to a close, and all the birds are suspended in flight, Not every man knows what is waiting for him, or what he shall sing When the ship he is on slips into darkness, there at the end.","['living', 'death']",153,770
death,Tradition,Lorine Niedecker,I The chemist creates the brazen approximation: Life Thy will be done Sun II Time to garden before I die— to meet my compost maker the caretaker of the cemetery,"['living', 'death', 'arts & sciences', 'humor & satire']",30,160
death,Rain,Edward Thomas,"Rain, midnight rain, nothing but the wild rain On this bleak hut, and solitude, and me Remembering again that I shall die And neither hear the rain nor give it thanks For washing me cleaner than I have been Since I was born into solitude. Blessed are the dead that the rain rains upon: But here I pray that none whom once I loved Is dying tonight or lying still awake Solitary, listening to the rain, Either in pain or thus in sympathy Helpless among the living and the dead, Like a cold water among broken reeds, Myriads of broken reeds all still and stiff, Like me who have no love which this wild rain Has not dissolved except the love of death, If love it be towards what is perfect and Cannot, the tempest tells me, disappoint.","['living', 'death', 'time & brevity', 'nature', 'weather']",138,732
death,"To His Watch, When He Could Not Sleep","Lord Edward, Lord Herbert of Cherbury","Uncessant Minutes, whil’st you move you tell The time that tells our life, which though it run Never so fast or farr, you’r new begun Short steps shall overtake; for though life well May scape his own Account, it shall not yours, You are Death’s Auditors, that both divide And summ what ere that life inspir’d endures Past a beginning, and through you we bide The doom of Fate, whose unrecall’d Decree You date, bring, execute; making what’s new Ill and good, old, for as we die in you, You die in Time, Time in Eternity.","['living', 'death', 'time & brevity']",96,521
death,The Past,Ralph Waldo Emerson,"The debt is paid, The verdict said, The Furies laid, The plague is stayed, All fortunes made; Turn the key and bolt the door, Sweet is death forevermore. Nor haughty hope, nor swart chagrin, Nor murdering hate, can enter in. All is now secure and fast; Not the gods can shake the Past; Flies-to the adamantine door Bolted down forevermore. None can re-enter there,— No thief so politic, No Satan with a royal trick Steal in by window, chink, or hole, To bind or unbind, add what lacked, Insert a leaf, or forge a name, New-face or finish what is packed, Alter or mend eternal Fact.","['living', 'death', 'time & brevity']",106,581
death,Yourself,Jones Very,"’Tis to yourself I speak; you cannot know Him whom I call in speaking such an one, For thou beneath the earth lie buried low, Which he alone as living walks upon; Thou mayst at times have heard him speak to you, And often wished perchance that you were he; And I must ever wish that it were true, For then thou couldst hold fellowship with me; But now thou hear’st us talk as strangers, met Above the room wherein thou liest abed; A word perhaps loud spoken thou mayst get, Or hear our feet when heavily they tread; But he who speaks, or him who’s spoken to, Must both remain as strangers still to you.","['living', 'death', 'sorrow & grieving']",116,602
