Label,Title,Poet,Poem,Tags,Poem_word_count,Poem_char_count
death,Prisoners,Denise Levertov,"Though the road turn at last to death’s ordinary door, and we knock there, ready to enter and it opens easily for us, yet all the long journey we shall have gone in chains, fed on knowledge-apples acrid and riddled with grubs. We taste other food that life, like a charitable farm-girl, holds out to us as we pass— but our mouths are puckered, a taint of ash on the tongue. It’s not joy that we’ve lost— wildfire, it flares in dark or shine as it will. What’s gone is common happiness, plain bread we could eat with the old apple of knowledge. That old one—it griped us sometimes, but it was firm, tart, sometimes delectable ... The ashen apple of these days grew from poisoned soil. We are prisoners and must eat our ration. All the long road in chains, even if, after all, we come to death’s ordinary door, with time smiling its ordinary long-ago smile.","['living', 'death', 'growing old', 'funerals']",158,855
death,Conversation,Ai,"for Robert Lowell We smile at each other and I lean back against the wicker couch. How does it feel to be dead? I say. You touch my knees with your blue fingers. And when you open your mouth, a ball of yellow light falls to the floor and burns a hole through it. Don’t tell me, I say. I don't want to hear. Did you ever, you start, wear a certain kind of silk dress and just by accident, so inconsequential you barely notice it, your fingers graze that dress and you hear the sound of a knife cutting paper, you see it too and you realize how that image is simply the extension of another image, that your own life is a chain of words that one day will snap. Words, you say, young girls in a circle, holding hands, and beginning to rise heavenward in their confirmation dresses, like white helium balloons, the wreaths of flowers on their heads spinning, and above all that, that’s where I’m floating, and that’s what it’s like only ten times clearer, ten times more horrible. Could anyone alive survive it?","['living', 'death']",189,1007
death,The Day Lady Died,Frank O'Hara,"It is 12:20 in New York a Friday three days after Bastille day, yes it is 1959 and I go get a shoeshine because I will get off the 4:19 in Easthampton at 7:15 and then go straight to dinner and I don’t know the people who will feed me I walk up the muggy street beginning to sun and have a hamburger and a malted and buy an ugly NEW WORLD WRITING to see what the poets in Ghana are doing these days I go on to the bank and Miss Stillwagon (first name Linda I once heard) doesn’t even look up my balance for once in her life and in the GOLDEN GRIFFIN I get a little Verlaine for Patsy with drawings by Bonnard although I do think of Hesiod, trans. Richmond Lattimore or Brendan Behan’s new play or Le Balcon or Les Nègres of Genet, but I don’t, I stick with Verlaine after practically going to sleep with quandariness and for Mike I just stroll into the PARK LANE Liquor Store and ask for a bottle of Strega and then I go back where I came from to 6th Avenue and the tobacconist in the Ziegfeld Theatre and casually ask for a carton of Gauloises and a carton of Picayunes, and a NEW YORK POST with her face on it and I am sweating a lot by now and thinking of leaning on the john door in the 5 SPOT while she whispered a song along the keyboard to Mal Waldron and everyone and I stopped breathing","['living', 'death', 'nature', 'summer', 'arts & sciences', 'music']",260,1295
death,In the Marble Quarry,James L. Dickey,"Beginning to dangle beneath The wind that blows from the undermined wood, I feel the great pulley grind, The thread I cling to lengthen And let me soaring and spinning down into marble, Hooked and weightlessly happy Where the squared sun shines Back equally from all four sides, out of stone And years of dazzling labor, To land at last among men Who cut with power saws a Parian whiteness And, chewing slow tobacco, Their eyebrows like frost, Shunt house-sized blocks and lash them to cables And send them heavenward Into small-town banks, Into the columns and statues of government buildings, But mostly graves. I mount my monument and rise Slowly and spinningly from the white-gloved men Toward the hewn sky Out of the basement of light, Sadly, lifted through time’s blinding layers On perhaps my tombstone In which the original shape Michelangelo believed was in every rock upon earth Is heavily stirring, Surprised to be an angel, To be waked in North Georgia by the ponderous play Of men with ten-ton blocks But no more surprised than I To feel sadness fall off as though I myself Were rising from stone Held by a thread in midair, Badly cut, local-looking, and totally uninspired, Not a masterwork Or even worth seeing at all But the spirit of this place just the same, Felt here as joy.","['living', 'death', 'arts & sciences', 'painting & sculpture']",226,1294
death,Bess,William E. Stafford,"Ours are the streets where Bess first met her cancer. She went to work every day past the secure houses. At her job in the library she arranged better and better flowers, and when students asked for books her hand went out to help. In the last year of her life she had to keep her friends from knowing how happy they were. She listened while they complained about food or work or the weather. And the great national events danced their grotesque, fake importance. Always Pain moved where she moved. She walked ahead; it came. She hid; it found her. No one ever served another so truly; no enemy ever meant so strong a hate. It was almost as if there was no room left for her on earth. But she remembered where joy used to live. She straightened its flowers; she did not weep when she passed its houses; and when finally she pulled into a tiny corner and slipped from pain, her hand opened again, and the streets opened, and she wished all well.","['living', 'death', 'health & illness']",177,944
death,American History,Michael S. Harper,"Those four black girls blown up in that Alabama church remind me of five hundred middle passage blacks, in a net, under water in Charleston harborso redcoats wouldn't find them. Can't find what you can't see can you?","['living', 'death', 'social commentaries', 'crime & punishment', 'history & politics', 'race & ethnicity']",38,216
death,Double Elegy,Michael S. Harper,"Whatever city or country road you two are on there are nettles, and the dark invisible elements cling to your skin though you do not cry and you do not scratch your arms at forty-five degree angles as the landing point of a swan in the Ohio, the Detroit River; at the Paradise Theatre you named the cellist with the fanatical fingers of the plumber, the exorcist, and though the gimmicky at wrist and kneecaps could lift the seance table, your voice was real in the gait and laughter of Uncle Henry, who could dance on either leg, wooden or real, to the sound of the troop train, megaphone, catching the fine pitch of a singer on the athletic fields of Virginia. At the Radisson Hotel, we once took a fine angel of the law to the convention center, and put her down as an egret in the subzero platform of a friend— this is Minneapolis, the movies are all of strangers, holding themselves in the delicacy of treading water, while they wait for the trumpet of the 20th Century Limited over the bluff or cranny. You two men like to confront. the craters of history and spillage, our natural infections of you innoculating blankets and fur, ethos of cadaver and sunflower. I hold the dogwood blossom, eat the pear, and watch the nettle swim up in the pools of the completed song of Leadbelly and Little Crow crooning the buffalo and horse to the changes and the bridge of a twelve-string guitar, the melody of “Irene”; this is really goodbye— I can see the precious stones of embolism and consumption on the platinum wires of the mouth: in the flowing rivers, in the public baths of Ohio and Michigan.","['living', 'death', 'nature', 'arts & sciences', 'music', 'funerals']",290,1597
death,Death,Bill Knott,"Going to sleep, I cross my hands on my chest. They will place my hands like this. It will look as though I am flying into myself.","['living', 'death']",27,129
death,Charon’s Cosmology,Charles Simic,With only his dim lantern To tell him where he is And every time a mountain Of fresh corpses to load up Take them to the other side Where there are plenty more I’d say by now he must be confused As to which side is which I’d say it doesn’t matter No one complains he’s got Their pockets to go through In one a crust of bread in another a sausage Once in a long while a mirror Or a book which he throws Overboard into the dark river Swift and cold and deep,"['living', 'death', 'funerals']",95,455
death,The Groundhog,Richard Eberhart,"In June, amid the golden fields, I saw a groundhog lying dead. Dead lay he; my senses shook, And mind outshot our naked frailty. There lowly in the vigorous summer His form began its senseless change, And made my senses waver dim Seeing nature ferocious in him. Inspecting close his maggots’ might And seething cauldron of his being, Half with loathing, half with a strange love, I poked him with an angry stick. The fever arose, became a flame And Vigour circumscribed the skies, Immense energy in the sun, And through my frame a sunless trembling. My stick had done nor good nor harm. Then stood I silent in the day Watching the object, as before; And kept my reverence for knowledge Trying for control, to be still, To quell the passion of the blood; Until I had bent down on my knees Praying for joy in the sight of decay. And so I left; and I returned In Autumn strict of eye, to see The sap gone out of the groundhog, But the bony sodden hulk remained. But the year had lost its meaning, And in intellectual chains I lost both love and loathing, Mured up in the wall of wisdom. Another summer took the fields again Massive and burning, full of life, But when I chanced upon the spot There was only a little hair left, And bones bleaching in the sunlight Beautiful as architecture; I watched them like a geometer, And cut a walking stick from a birch. It has been three years, now. There is no sign of the groundhog. I stood there in the whirling summer, My hand capped a withered heart, And thought of China and of Greece, Of Alexander in his tent; Of Montaigne in his tower, Of Saint Theresa in her wild lament.","['living', 'death', 'nature', 'animals', 'summer', 'social commentaries', 'history & politics']",301,1618
death,Looking into History,Richard Wilbur,"I. Five soldiers fixed by Mathew Brady’s eye Stand in a land subdued beyond belief. Belief might lend them life again. I try Like orphaned Hamlet working up his grief To see my spellbound fathers in these men Who, breathless in their amber atmosphere, Show but the postures men affected then And the hermit faces of a finished year. The guns and gear and all are strange until Beyond the tents I glimpse a file of trees Verging a road that struggles up a hill. They’re sycamores. The long-abated breeze Flares in those boughs I know, and hauls the sound Of guns and a great forest in distress. Fathers, I know my cause, and we are bound Beyond that hill to fight at Wilderness. II. But trick your eyes with Birnam Wood, or think How fire-cast shadows of the bankside trees Rode on the back of Simois to sink In the wide waters. Reflect how history’s Changes are like the sea’s, which mauls and mulls Its salvage of the world in shifty waves, Shrouding in evergreen the oldest hulls And yielding views of its confounded graves To the new moon, the sun, or any eye That in its shallow shoreward version sees The pebbles charging with a deathless cry And carageen memorials of trees. III. Now, old man of the sea, I start to understand: The will will find no stillness Back in a stilled land. The dead give no command And shall not find their voice Till they be mustered by Some present fatal choice. Let me now rejoice In all impostures, take The shape of lion or leopard, Boar, or watery snake, Or like the comber break, Yet in the end stand fast And by some fervent fraud Father the waiting past, Resembling at the last The self-established tree That draws all waters toward Its live formality.","['living', 'death', 'nature', 'animals', 'seas', 'rivers', '& streams', 'trees & flowers', 'social commentaries', 'history & politics', 'war & conflict']",309,1694
death,Middle Passage,Robert Hayden,"IJesús, Estrella, Esperanza, Mercy: Sails flashing to the wind like weapons, sharks following the moans the fever and the dying; horror the corposant and compass rose. Middle Passage: voyage through death to life upon these shores. “10 April 1800— Blacks rebellious. Crew uneasy. Our linguist says their moaning is a prayer for death, ours and their own. Some try to starve themselves. Lost three this morning leaped with crazy laughter to the waiting sharks, sang as they went under.”Desire, Adventure, Tartar, Ann: Standing to America, bringing home black gold, black ivory, black seed. Deep in the festering hold thy father lies, of his bones New England pews are made, those are altar lights that were his eyes.","['living', 'death', 'activities', 'travels & journeys', 'nature', 'seas', 'rivers', '& streams', 'social commentaries', 'crime & punishment', 'history & politics', 'race & ethnicity', 'war & conflict', 'kwanzaa']",117,715
death,The Strange People,Louise Erdrich,"The antelope are strange people ... they are beautiful to look at, and yet they are tricky. We do not trust them. They appear and disappear; they are like shadows on the plains. Because of their great beauty, young men sometimes follow the antelope and are lost forever. Even if those foolish ones find themselves and return, they are never again right in their heads. —Pretty Shield, Medicine Woman of the Crows transcribed and edited by Frank Linderman (1932) All night I am the doe, breathing his name in a frozen field, the small mist of the word drifting always before me. And again he has heard it and I have gone burning to meet him, the jacklight fills my eyes with blue fire; the heart in my chest explodes like a hot stone. Then slung like a sack in the back of his pickup, I wipe the death scum from my mouth, sit up laughing and shriek in my speeding grave. Safely shut in the garage, when he sharpens his knife and thinks to have me, like that, I come toward him, a lean gray witch through the bullets that enter and dissolve. I sit in his house drinking coffee till dawn and leave as frost reddens on hubcaps, crawling back into my shadowy body. All day, asleep in clean grasses, I dream of the one who could really wound me. Not with weapons, not with a kiss, not with a look. Not even with his goodness. If a man was never to lie to me. Never lie me. I swear I would never leave him.","['living', 'death', 'activities', 'eating & drinking', 'sports & outdoor activities', 'nature', 'animals']",267,1399
death,The Asians Dying,W. S. Merwin,When the forests have been destroyed their darkness remains The ash the great walker follows the possessors Forever Nothing they will come to is real Nor for long Over the watercourses Like ducks in the time of the ducks The ghosts of the villages trail in the sky Making a new twilight Rain falls into the open eyes of the dead Again again with its pointless sound When the moon finds them they are the color of everything The nights disappear like bruises but nothing is healed The dead go away like bruises The blood vanishes into the poisoned farmlands Pain the horizon Remains Overhead the seasons rock They are paper bells Calling to nothing living The possessors move everywhere under Death their star Like columns of smoke they advance into the shadows Like thin flames with no light They with no past And fire their only future,"['living', 'death', 'social commentaries', 'war & conflict']",148,836
death,For the Anniversary of My Death,W. S. Merwin,Every year without knowing it I have passed the day When the last fires will wave to me And the silence will set out Tireless traveler Like the beam of a lightless star Then I will no longer Find myself in life as in a strange garment Surprised at the earth And the love of one woman And the shamelessness of men As today writing after three days of rain Hearing the wren sing and the falling cease And bowing not knowing to what,"['living', 'death', 'time & brevity']",84,429
death,Chaplinesque,Hart Crane,"We make our meek adjustments, Contented with such random consolations As the wind deposits In slithered and too ample pockets. For we can still love the world, who find A famished kitten on the step, and know Recesses for it from the fury of the street, Or warm torn elbow coverts. We will sidestep, and to the final smirk Dally the doom of that inevitable thumb That slowly chafes its puckered index toward us, Facing the dull squint with what innocence And what surprise! And yet these fine collapses are not lies More than the pirouettes of any pliant cane; Our obsequies are, in a way, no enterprise. We can evade you, and all else but the heart: What blame to us if the heart live on. The game enforces smirks; but we have seen The moon in lonely alleys make A grail of laughter of an empty ash can, And through all sound of gaiety and quest Have heard a kitten in the wilderness.","['living', 'death', 'growing old']",165,885
death,I Killed a Fly,David Ignatow,"I killed a fly and laid my weapon next to it as one lays the weapon of a dead hero beside his body—the fly that tried to mount the window to its top; that was born out of a swamp to die in a bold effort beyond itself, and I am the one who brought it to an end. Tired of the day and with night coming on I lay my body down beside the fly.","['living', 'death']",76,337
death,"On the Funeral of Charles the First at Night, in St. George’s Chapel, Windsor",William Lisle Bowles,"The castle clock had tolled midnight: With mattock and with spade, And silent, by the torches’ light, His corse in earth we laid. The coffin bore his name, that those Of other years might know, When earth its secrets should disclose, Whose bones were laid below. “Peace to the dead” no children sung, Slow pacing up the nave,— No prayers were read, no knell was rung, As deep we dug his grave. We only heard the winter's wind, In many a sullen gust, As, o’er the open grave inclined, We murmured, “Dust to dust!” A moonbeam from the arch’s height Streamed, as we placed the stone; The long aisles started into light, And all the windows shone. We thought we saw the banners then, That shook along the walls, Whilst the sad shades of mailèd men Were gazing on the stalls. ’Tis gone! again on tombs defaced Sits darkness more profound; And only by the torch we traced The shadows on the ground. And now the chilling, freezing air Without blew long and loud; Upon our knees we breathed one prayer, Where he slept in his shroud. We laid the broken marble floor,— No name, no trace appears,— And when we closed the sounding door, We thought of him with tears.","['living', 'death', 'sorrow & grieving', 'social commentaries', 'history & politics', 'heroes & patriotism', 'funerals']",211,1154
death,Epitaph on the Lady Mary Villiers,Thomas Carew,"This little vault, this narrow room, Of Love, and Beauty, is the tomb; The dawning beam that gan to clear Our clouded sky, lies darken'd here, Forever set to us, by death Sent to inflame the world beneath. 'Twas but a bud, yet did contain More sweetness than shall spring again; A budding star that might have grown Into a sun, when it had blown. This hopeful beauty did create New life in Love's declining state; But now his empire ends, and we From fire and wounding darts are free; His brand, his bow, let no man fear, The flames, the arrows, all lie here.","['living', 'death']",105,559
death,The Dying Child,John Clare,"He could not die when trees were green, For he loved the time too well. His little hands, when flowers were seen, Were held for the bluebell, As he was carried o'er the green. His eye glanced at the white-nosed bee; He knew those children of the spring: When he was well and on the lea He held one in his hands to sing, Which filled his heart with glee. Infants, the children of the spring! How can an infant die When butterflies are on the wing, Green grass, and such a sky? How can they die at spring? He held his hands for daisies white, And then for violets blue, And took them all to bed at night That in the green fields grew, As childhood's sweet delight. And then he shut his little eyes, And flowers would notice not; Birds' nests and eggs caused no surprise, He now no blossoms got; They met with plaintive sighs. When winter came and blasts did sigh, And bare were plain and tree, As he for ease in bed did lie His soul seemed with the free, He died so quietly.","['living', 'death', 'infancy', 'sorrow & grieving', 'nature', 'spring', 'trees & flowers', 'funerals']",189,972
death,"Fragment 3: Come, come thou bleak December wind",Samuel Taylor Coleridge,"Come, come thou bleak December wind, And blow the dry leaves from the tree! Flash, like a Love-thought, thro' me, Death And take a Life that wearies me.","['living', 'death', 'disappointment & failure', 'nature', 'trees & flowers', 'weather', 'winter']",28,152
death,The Bustle in a House (1108),Emily Dickinson,The Bustle in a House The Morning after Death Is solemnest of industries Enacted opon Earth – The Sweeping up the Heart And putting Love away We shall not want to use again Until Eternity –,"['living', 'death', 'sorrow & grieving', 'activities', 'jobs & working', 'funerals']",36,189
death,A Burnt Ship,John Donne,"Out of a fired ship, which by no way But drowning could be rescued from the flame, Some men leap'd forth, and ever as they came Near the foes' ships, did by their shot decay; So all were lost, which in the ship were found, They in the sea being burnt, they in the burnt ship drown'd.","['living', 'death', 'social commentaries', 'war & conflict']",57,283
death,"Epitaph on Elizabeth, L. H.",Ben Jonson,"Wouldst thou hear what man can say In a little? Reader, stay. Underneath this stone doth lie As much beauty as could die; Which in life did harbour give To more virtue than doth live. If at all she had a fault, Leave it buried in this vault. One name was Elizabeth, Th' other let it sleep with death: Fitter, where it died to tell, Than that it liv'd at all. Farewell.","['living', 'death', 'sorrow & grieving']",72,368
death,Child of a Day,Walter Savage Landor,"Child of a day, thou knowest not The tears that overflow thy urn, The gushing eyes that read thy lot, Nor, if thou knewest, couldst return! And why the wish! the pure and blest Watch like thy mother o'er thy sleep. O peaceful night! O envied rest! Thou wilt not ever see her weep.","['living', 'death', 'infancy', 'sorrow & grieving', 'funerals']",54,280
death,The Cross of Snow,Henry Wadsworth Longfellow,"In the long, sleepless watches of the night, A gentle face — the face of one long dead — Looks at me from the wall, where round its head The night-lamp casts a halo of pale light. Here in this room she died; and soul more white Never through martyrdom of fire was led To its repose; nor can in books be read The legend of a life more benedight. There is a mountain in the distant West That, sun-defying, in its deep ravines Displays a cross of snow upon its side. Such is the cross I wear upon my breast These eighteen years, through all the changing scenes And seasons, changeless since the day she died.","['living', 'death', 'sorrow & grieving', 'nature', 'winter']",117,605
death,Excelsior,Henry Wadsworth Longfellow,"The shades of night were falling fast, As through an Alpine village passed A youth, who bore, 'mid snow and ice, A banner with the strange device, Excelsior! His brow was sad; his eye beneath, Flashed like a falchion from its sheath, And like a silver clarion rung The accents of that unknown tongue, Excelsior! In happy homes he saw the light Of household fires gleam warm and bright; Above, the spectral glaciers shone, And from his lips escaped a groan, Excelsior! ""Try not the Pass!"" the old man said; ""Dark lowers the tempest overhead, The roaring torrent is deep and wide!"" And loud that clarion voice replied, Excelsior! ""Oh stay,"" the maiden said, ""and rest Thy weary head upon this breast! "" A tear stood in his bright blue eye, But still he answered, with a sigh, Excelsior! ""Beware the pine-tree's withered branch! Beware the awful avalanche!"" This was the peasant's last Good-night, A voice replied, far up the height, Excelsior! At break of day, as heavenward The pious monks of Saint Bernard Uttered the oft-repeated prayer, A voice cried through the startled air, Excelsior! A traveller, by the faithful hound, Half-buried in the snow was found, Still grasping in his hand of ice That banner with the strange device, Excelsior! There in the twilight cold and gray, Lifeless, but beautiful, he lay, And from the sky, serene and far, A voice fell like a falling star, Excelsior!","['living', 'death', 'activities', 'travels & journeys']",239,1391
death,Resumé,Dorothy Parker,Razors pain you; Rivers are damp; Acids stain you; And drugs cause cramp. Guns aren’t lawful; Nooses give; Gas smells awful; You might as well live.,"['living', 'death', 'arts & sciences', 'humor & satire']",26,148
