Label,Title,Poet,Poem,Tags,Poem_word_count,Poem_char_count
death,Portrait with Smeared Centuries,Michael Wasson,"I begin the day like any other day: a decade staring back in the rearview mirror of the wrecked pickup truck: you standing so tall you’re already headless: until I turn around the cornfield blurs into the torn edges of an atlas: pull your hands out from under me to anoint this god- given country of yours: mottled bones singing the anthem of a star- spangled nation: this land given enough time to list its own possibilities: atrocities like a blade of dusk resting on my throat, I bruise: by standing I practice the sacred: & kneel how the body was built toward the bottomless insides of ghosts: the small of my back the sacrum: they say, the five disciples with pocked faces unlike your self-inflicted gunshot but a single entryway: an emptiness full of faith: rise to me as only you would after god has left you with these entrance wounds with no way out: the purpling field that goes on & on: recognizable as a heartbeat: a century- long orbit around a cage of stained glass: broken, you gather me in your image of failed flesh: piecing mirror after mirror back together through the night until nobody forgets: one hundred years of this landscape behind & before us continues to stir — even if the earth under our knees, under every American sky, had been turning west- ward for centuries.","['living', 'death', 'social commentaries', 'history & politics']",232,1294
death,Death,Crisosto Apache,"For E.P. Kazhe/Botella The dread, however, was not of death’s agonies. — Ryūnosuke Akutagawa, tr. by Will Petersen it is prohibited to whisper the names of the dead, as it encourages them to linger at the doorstep, and she has already lingered, far too long","['living', 'death', 'sorrow & grieving']",45,257
death,The Diagnosis,John Lee Clark,"An erasure of Henry Wadsworth Longfellow’s “Palingenesis” I, sobbing in the rolling mist, Started for peopled days. In dreams A faded, lonely promontory shed petals. Belief exists. Cunning with its perfume Working from youth, defiance. A phantom Vanished. The swift surrenders, leap into The old dead heart of lies. I will give, remembering my turns Into foliage. Of what light unseen! What, what, what, what, what, what Will hold still without its end?","['living', 'death', 'growing old']",73,453
death,The Silence Will Be Sudden Then Last,Deborah Landau,"Sybaritic afterlife I don’t crave you. I like daylight. I like crowds. I don’t think it will be charming underground. The silence will be sudden then last. What’s chic will shrink. There won’t be any pretty, pity. Will never peaches there, or air. We’ll be so squashed and sour there. I don’t want a cold place. Don’t want a threadbare clamp and consequence all old. Our loneliness will be prolonged then go too far. Oh fuck it’s true. Then nothing left of you.","['living', 'death', 'time & brevity']",83,461
death,Decrescence,Yanyi,"The Queen sits on a throne of gem-trimmed robes. Between her robes the jutted moth, it follows dust. She can’t rest before the funeral, her self- unmaking, some maid whose hair is browned by blood; a matching queen. Nights’ dim candles, grackles’ glib decrescence.Now dance, now weep. No rest for feet still warm from summer’s phrasing — odors / ankle / thorn. Keeping time while dying, the Queen grows bored, her hand’s throat out, amiss. (Yet I sob, I paw. Yet) I kiss.","['living', 'death', 'the body', 'mythology & folklore', 'fairy-tales & legends']",83,471
death,"Other Things, If Not More Urgent Things",Natalie Shapero,"How to get close without going over. How to feign lust for whatever’s on offer. How the largest possible quantity of anything is a lifetime. A lifetime of oat bran. A lifetime of timing belts. A lifetime of saying, sure, why not,i’m only on earth x numberof years, and not knowing what to make x. Sometimes I pick a number I’ve already passed. I remember the gambler’s credo — when you only have fifty bucks left in this world, you’d better get rid of it fast; the last thing you want is money around, reminding you every day of the money you lost. The recommended retirement plan is arabesque, then leap and smash on the seawall. We made a promise not to catch each other.","['living', 'death', 'growing old', 'life choices', 'time & brevity']",125,673
death,From “Girls That Never Die”,Safia Elhillo,a girl buried to the chest in red earth her wrists bound beneath the soil with twine a crowd gathers to father her its infinite hands curved loosely around a stone small enough that no single throw is named as cause of death no single hand accountable to the blood the girl undaughter unnamed unfaced undone from the lineage her photographs pulled already from bookshelf from walls her father among the hands his pebble streaked with quartz the first to rise to carve the air & arc toward the girl the rootless tree faceless & erect & perhaps the stones twisting like fireworks the girl their nucleus rise & rise for a time opposite of rain opposite of hail & perhaps the silence a beat too long & another another & then a rustling of wings above the girl a flock thick mixed cloud of avifauna partridge & nightjar & golden sparrow & avocet & lapwing & every other sort of plover & ibis & heron & gulls though the sea is far & to the north & the minutes pass & the girl is untouched & each bird in its beak tongues a stone • [what if i will not die] [what will govern me then] [how to govern me then] [what bounty then on my name] [what stone what rope what man will be my officer],"['living', 'death', 'nature', 'animals', 'social commentaries', 'crime & punishment', 'gender & sexuality', 'mythology & folklore', 'ghosts & the supernatural']",228,1181
death,Recital at the Court of King Carrot III,Michael Farrell,"Mortality is itself immortal Leo thought, reminded five years later of the performance. Having come, despite his Irish darkness, to resemble one of the Carrot clan himself. Whatever he had read, and the feelings that went along with those books, articles and poems, layered his unconscious now like lava. What was the voice of that moment, he questioned his uni-ball pen. The playing fingers, the singer, the wind that came in and made King Carrot pop his collar. As even the King’d say now, after Usher. Usher’ll die like everyone else but not for a few decades yet, touch head. Where Leo wandered as if streets were wild with flowers rather than construction Mortality was in memory: mortality was immortality even. Quotidian checking, marking, jogging things along (e.g. the economy) these are the columns and emojis of obituary. The privileged sublime? The working artist reading the world under a misprinted title, taking pills to still contradiction, lines of sky gray, and greenery (tracing the eyeline of buildings’ weed mascara). The forcing of life through an earth crumbling with fatigue and love gone wrong: or was that the humans standing on it? Yes, we all needed some grace to get from one side of town to the other. And how have a career without going up some real stone steps? To see things and write them up, whether on bench or phone while stopping, or on a keyboard once home. To Leo death was always shocking: whether blighted cornfield defunct toaster or road possum. Anything might’ve had poison tipped into its ear: think of Carrot III slumping as the piano lid closed, and knocking a candle over. The singer leaping from her stool, suffocating the flames before giving the gift of life, making every line she’d sang that night seem crucial. That’s what Leo—and probably everyone else who was there—remembered, if only because a new song about superficial human life (“A river is thicker than royal blood”) soon ruled the air","['living', 'death', 'life choices', 'arts & sciences', 'music', 'social commentaries', 'history & politics']",330,1949
death,Black Coffin with Milk,Michael Farrell,"Take the measure of wooden speech with a wooden tongue The sound waves crash in, like a handful of grasshoppers Take the nails and bang them into the weeping painting The kids are shouting what they’re for: it’s making noise Making noise and drinking milk with a magnifying glass The ancestor’s dead from reading books and breathing From boxing vegetables and reading books and breathing The cardboard boxes are in his brain in tiny mirroring bits From the vein in his forehead to the vein in his toe they run They run like children to the school milk and the myths Out of the crush they would say of him, mad as a string The trees would say different of course when they saw him Out of grace, they never were, they would mimic Umback The leaves in his hair were the marks of a bush comedy A bush comedy so good it could run forever without seats The little version of the novel, every novel he read at night That he played out with his bosses, with strangers, his wife The wife has another ancestor with the same name, related That the lightning spilled down the hill in hot liquid form A form that was repeated and parodied in the hill’s plants Take this string and wrap it round the painting as if alive As if alive and attempting to survive out there in the bush Take the clock and time the boy who went to get the milk As if you can get milk from a large white rabbit that makes The sound of death, chewing grasshoppers like a machine","['living', 'death', 'youth', 'nature', 'animals', 'arts & sciences', 'painting & sculpture', 'reading & books']",272,1439
death,john brown’s,Geraldine Clarkson,fine parchment face suddenly chantilly lace his torso a doily perforated twinkling with sweet patient fungus shiny maggot- milled one old gold trinket slipped between two ribs his legs folded and cold he too was somebody’s honeybunch and heartleap his jaw an ox-bone his eyes full of lake his burring voice booming out bold songs likejohn bro-own’s body da-da da-da da da da,"['living', 'death', 'the body', 'social commentaries', 'history & politics', 'war & conflict']",63,374
death,"Eurydice, Run",Harmony Holiday,Just like Jesus I am a time machine I go away I come back they won’t let me watch things die and the spy in the spine a hearse of sense and rumors a bundle of all that’s possible in a body tied to its back with the babble of hypocrites and dirty rivers if you fall asleep in yellow and awake in a bed of cotton wool with a star of nails where your heart should go and the cosmetics of wartime blood lipping wax in a factory basement attached to a slab of maple you do not have to love that man to slice his lips and scream what divination turned into demon by ignoring you alone can remember and revert to God I give the woven whisper of a kid to her first brown doll mounted to a branch of song she sings reasons that we fear ourfeelings— To the dice in the tree she is singing as the torches come up throbbing and grinning a crimson minnow in her last est lap,"['living', 'death', 'time & brevity', 'youth', 'social commentaries', 'race & ethnicity', 'mythology & folklore', 'greek & roman mythology']",176,861
death,Diagnosis,Meena Alexander,So how will it end? You want it straight?,"['living', 'death', 'health & illness', 'the body', 'nature', 'spring', 'summer', 'arts & sciences', 'poetry & poets']",9,41
death,Revenant,Meena Alexander,"This disease has come backWith frills and furbelows.You must give your whole life to poetryOnly a few survive if that— Poems I mean, paper crumpledShades of another water— Far springs are what you long for,Listening for the slow drip of chemicals Through a hole in your chest.If you were torn from meI could not bear what the earth had to offer.","['living', 'death', 'health & illness', 'time & brevity', 'nature', 'spring', 'arts & sciences', 'poetry & poets', 'mythology & folklore', 'ghosts & the supernatural']",61,345
death,The Following Scan Will Last Four Minutes,Lieke Marsman,Before you sink away into the morphinesweet unreality of the everyday we would like to say something about those spasms and fasciculations of yours as well as that bump on your back For years you have no doubt been googling every freckle Just recently you were at the doctor’s with a patch of dry skin on your leg Diagnosis: too much shower gel But on hearing the word chondrosarcoma you went home and immediately unplugged your router Do you know where your priorities lie? Do you know what life has to offer or did those endless therapy sessions and that eight-week mindfulness course simply teach you how to tolerate suffering that every signal in your body can be temporarily expelled to the rhythm of some breathing exercise?Let the pain beTo be free is to be free of need Wrong To be free is to need some fresh air and to be able to get up and go outside Don’t say we didn’t warn you Translated from the Dutch,"['living', 'death', 'health & illness', 'the mind']",168,915
death,At the End of the Day,Shira Dentz,"end- and be-any, make ends hour, at the end on my haze, elf’s well that ends well, at a fair end, an end as itself, any good must come to an end, tie is loose ends, end on the line, defanging on the end, end as sight, coming to a man end, end as took, hour a terrible end, to end on the ticks, team end, on the semiotics end, light at the end of the tunnel, choking both ends, does the end justify the bound, short end on the brand, know which end is is, now-end, toss-end, you haven’t heard the end on it, follow me to the ends.","['living', 'death', 'growing old', 'time & brevity', 'arts & sciences', 'language & linguistics']",110,529
death,Mango hats stood out from the rest,Shira Dentz,"Canary-yellow dice aren’t what you think, seller said in their shop where they sold all things canary— whistles, sweets, frills, perfumes, with hints of cherry chance, a throw of canary. Much hinges on canary, Canary said in their shop where they sold sunny vanes on canary die. Forgive me for showing myself a composed canary, live or not.","['living', 'death', 'nature', 'animals']",58,340
death,Afterword,Desirée Alvarez,"Chile, chocolate, coyote, guacamole, mezcal, peyote, tomato, ocelot, tequila—the words survive months of siege, 240,000 dead in Tenochtitlan. The Place of Herons, a place of whiteness, did not survive. Duende, a tiny face in a calla lily, survived. A bowl decorated with scorpion and pelican survived. Clay faces full of shadow. Sculptors who understood light, how it addresses the afterlife, expecting a great dark to fall.","['living', 'death', 'arts & sciences', 'language & linguistics', 'painting & sculpture', 'social commentaries', 'history & politics', 'race & ethnicity', 'war & conflict']",66,424
death,The Solitary Land,Adonis,"I inhabit these fugitive words, I live, my face my face’s lone companion, And my face is my path, In your name, my land That stands tall, enchanted and solitary; In your name, death, my friend. Translated from the Arabic","['living', 'death', 'arts & sciences', 'language & linguistics']",40,220
death,The Up Side,Ron Padgett,The pines are stately still reflecting upon themselves without knowing it in eternity upside down.,"['living', 'death', 'the mind', 'time & brevity', 'nature', 'trees & flowers']",15,98
death,Clocked,Ron Padgett,"I’m going to look at my watch though I don’t really care what time it is. Just slightly curious. It’s funny when you see it’s much earlier or later than you thought, but even funnier when it’s exactly the time you thought. But at my back etc.Etc. being “Desarts of vast Eternity.” I give up. It’s eleven eleven. What ever happens at eleven eleven? Vast eternity!","['living', 'death', 'time & brevity']",66,362
death,Song for Refugees,Philip Metres,"After Mohamad Zatari Ooze, oud. Ease hearts whose eyes sink low. Be hourglass in the pillaged O—. Be wells none see. Unstoppered tears, O oud, we gather in your bowl. O ladle of ores, scoop ink here now seeping from the foreigner, be sighs, O oud, and cloven aches in the dark of millions of ears. Be gift for famished wails and wakes to lacks and flares and tented stakes, the lonely outer sounds of sleeves eating wind and drowning faces. The oud’s a lovely ark that leaks with tales and bromides we can’t keep, and miles of ghosts before their sleep. And miles of ghosts beneath our sleep.","['living', 'death', 'arts & sciences', 'music', 'social commentaries', 'history & politics', 'war & conflict']",109,592
death,“I want you to leave your body now” he tells me,Wayne Holloway-Smith,his voice not so much hypnotic as reachingfor the hypnotic but I leave it anyway sitting in the upright chair of the windowless room for a place higher up that’s not quite the windowless room— though I’m aware of my body’s particular kind of breathing down there dressed in my favorite shirt and somehow up here I’m dressed in that same shirt which is I feel suddenly becoming very important its color pertaining to a quiet hue of knowing I can’t quite explain and I do not think about the money I have given him the man who is speaking but I’m looking instead down on a yellow kitchen in Swindon upon a tiny remembered body I have found crying or about to cry in little white shorts and there is carpet streaked with blue and there is the noise of a terrible thing that is happening and there is summer outside with its other children “He doesn’t understand does he” says the man “he is so young” and I understand the shirt that he will have to grow through all of the terrible things to fit I can feel my body now filling up the space inside its soft and lavender-scented cotton,"['living', 'death', 'the mind', 'youth', 'mythology & folklore', 'ghosts & the supernatural']",203,1080
death,Galah’s Skull,Sarah Holland-Batt,"I find it in a field of feathers, pink-crested,a knuckle of bone picked clean by the wind,a pale mohawk mounted on stone.I bend down. Zeroed out of its head are two sockets, two airy planetsfull with sun, and taking asylum in onea millipede is coiled, a slick black hypnotist.Polished, it spirals in on itselflike one of Saint Hilda’s fossil snakeswe studied in the school chapel’s stained glass. As if the eye could dig itself into the earth then extend a curled feeler out, like a fern.I turn the skull round in my palm like a pebble—it will not settle. Otherwise, all is still: the grasses claw in, the world does not tilt.Even the blue stand of scrub grows over;it has nothing on its mind. But the skull will outlast the summer, a thought cut short,and I will pass it every day as I walkand stop just here, where the air hones its teethon bone, where the mind remembers itselfonly as a shell, and I will mourn what was once a world: one eye rolled to the daylight moon, the other pressed down into the earth.","['living', 'death', 'nature', 'animals']",185,1012
death,Bees of Eleusis,Franz Wright,"Unless a grain of wheat goes into the ground and dies, it remains nothing but a grain of wheat. —John 12:24 The ingredients gathered, a few small red tufts of the dream spoor per sheaf of Demeter’s blonde wheat, reaped in mourning, in silence, ground up with the pollen and mixed into white wine and honey. These stored forms of light taken under the ground. Taken by mouth. First those who by birth hold in secret the word; then placed on the tongues of the new ones, into whose ears it is meant to be whispered. Word murdered, forgotten so long ago, placed as a kiss on the lips of the soon-to-be-no-longer breathing who mean to enter death with open eyes, with mouths saying Death, what death? We have no word for it in our country where the bride of a brighter oblivion reigns. Not the purple-haired god but the child queen, the raped girl, come back from the dead hand in hand with the child she conceived there, returned in a resurrected virginity, wind through green wheat. Present-day site of a minor refinery in Christ. Although by the tenth generation already the children of light (“in their dark garments”) had trampled and smashed and generally raped the two thousand years of this precinct and its holy meal, intolerable mirror. Men who’d designed and bowed down to a law derived from the sayings of one who appeared here to say that the law is abolished, it is too late, all that is over with. Men who bungled their way through the next eighteen centuries before finally descending into the earth themselves, and what they found there they used, and we thank you for destroying the destroyers of the world. And here at the end this is as good as any other entrance to the underplace, journey of the fallen leaf back to the branch, to the bees of Eleusis among olive blossoms, untroubled among crimson wildflowers. Four thousand years later: same flowers, same bees.","['living', 'death', 'nature', 'trees & flowers', 'mythology & folklore', 'greek & roman mythology']",334,1880
death,His Ambulations,Thomas P. Lynch,"On shanks’ mare Argyle talked to himself.Alone, he’d carry on whole colloquiesen route to some poor corpse’s obsequies—these dialogues, the way he kept his witsabout him, body and soul together,fit for the wretched work of sin-eating.Sometimes he counted words or parts of wordsas if they amounted to something morethan sound and sense attuned between his ears,as, for example, how coincident:the way grace and gratis, wherefore gratitudepartook a kinship such as cousins do,singing the same tune in different voices,much as grave and gravitas, then gravitykept one earthbound, grounded, humble as the mud—the humus, so-called, God wrought humans from. Or how from Adam’s rib was fashioned Eve—bone of his own bone, flesh of his flesh—whom he got gravid by implanting seed,in her unfathomably fecund Eden.The memory of a woman’s companywould bring his ambulations to a haltto aim his gaping face due heavenward, the dewy air her touch, her taste, sweet salt.","['living', 'death', 'arts & sciences', 'language & linguistics']",149,958
death,"Shanidar, Now Iraq",Sarah Lindsay,"When bones and flesh have finished their business together,we lay them carefully, in positions they’re willing to keep,and cover them over.Their eyes and ours won’t meet anymore. We hope.It’s one of the oldest rules we mostly follow.In the deep Stone Age in Shanidar, now Iraq,someone or all of them laid or threw on the grandfather’s chestwhatever was blooming—St. Barnaby’s thistle, yarrow, hollyhock...His was their only burial before the frost.For millennia, then, the dead might go under with thistle,quantities of red ocher, a chunk of meat.Now we have everlasting bouquets of plastic;now we have hundreds a day to bag and box and pickleto re-cross the Atlantic.Light a row of oil wells and kneelon sand too much embroiled for tombs.Regrettably, something of the smellis of bodies suddenly buried in fallen stones.But some is incense, pinches of pulverized Baghdad risingin ceremonial smoke:dust of combatants, onlookers, miscellaneous limbs,contents of hovels, contents of museums,ancient pollen of yarrow and hollyhock.","['living', 'death', 'social commentaries', 'history & politics', 'war & conflict']",154,1027
death,Little Aster,Gottfried Benn,"A drowned drayman was hoisted on to the slab. Someone had jammed a lavender aster between his teeth. As I made the incision up from the chest with a long knife under the skin to cut out tongue and gums, I must have nudged it because it slipped into the brain lying adjacent. I packed it into the thoracic cavity with the excelsior when he was sewn up. Drink your fill in your vase! Rest easy, little aster!","['living', 'death', 'the body', 'mythology & folklore', 'horror']",78,406
death,Dominion Over the Larger Animal,Sophie Cabot Black,"How many times I have providedFor your death; the apple turned one wayThen the other, an arrangement made, The softer ground. To hold your head As if this mattered, to say what I thinkEssential into your ear,To watch the eye look everywhere to findWhat it does not know it looks for.To fasten you down in the one placeWhere no one can say anything more,Being nothing else but breath leaving,While the man with the needle stands byUntil the signal of how it is time. To believeI know what will happen next; to leave the hill As the body stiffens; to pass each blossomOf blood in the snow as if I understood All I was capable of.","['living', 'death', 'life choices', 'nature', 'animals']",115,627
death,Self-Portrait after Paul Morphy’s Stroke,Josh Wild,"Paul lost his footing, turned out a spectacular corkscrew.It looked like he was acting out a series of renga in the air. The general theme was prevenient grace.But the white rim broke his form, and he hit the bathtub water like a big charred bough of a tree.A semicircle of his shoes—Oxfords, monk straps,bluchers, a lone boot—crowded in to get a look.After that, Morphy was only surface. You can lookinto anything and see what you want. For example,Pierre swore he could read stock returnsin the little channels of Morphy’s pruned thumbs.He even called in Schiaparelli’s niece. She enteredwith a shoe on her head, I swear. There are pictures,look it up. My uncle, my unfortunate uncle,says the whole event—Morphy in the tub—lookedfloral, with shoe petals. Just to be difficult, I said“saucer of milk”: a teacup on a dish, alone in thequiet, waiting for a cougar to come by. Ialways bank on something parched and amblingto make my point. Or else something with abroken heel, covered in wet newspaper andhuddled up next to the highway. All thumbs.","['living', 'death', 'arts & sciences', 'humor & satire', 'poetry & poets']",175,1046
