Label,Title,Poet,Poem,Tags,Poem_word_count,Poem_char_count
philosophy,how to get over (senior to freshman),T'ai Freedom Ford,"pick the big bitch:the chick who look likeshe chew screwdrivers.hunched at the lunch table copying homework,shredding syllables with a mouthful of metal.shush the rebelin your throat, that ghost of punk funkingdark circles in the pits of your polo.resist the impulse to shittalk your waythrough ranch dressing and lunchroom throng.bumrush: snatchsong from her ears, tangle of headphonewires and tracks of mangled weave.nevermind uglying her facewith nails or an armful of bangles.she already a jigsaw puzzleof scratch and scar, every exposed partcaked in vaseline. every fold of fatfortified with that free-free — french fries,chickenshit shaped like tenders, cheese sticks.she will slip’n slide youif you don’t come correct.pick you up by your bookbagtill you feel fly, camera phone red eyeswinking your punkass almost famous.but that ain’t your fame to claim.pitbull her ankles till she drop,till ketchup and corn splatter,scatter abstract like techniquefrom our 5th period art class.as she knuckles herself upfrom chickenfeed, ain’t no need to run.instead smile for the video,that soul-clap in your chestis your heart.","['living', 'the body', 'activities', 'school & learning', 'philosophy', 'social commentaries', 'race & ethnicity']",164,1121
philosophy,At My Best,John Rodriguez,"August is the cruelest month: never enough daylight, too muchheat, no holidays and nothing matters except September’sdawning responsibilities, but the August of 1994 I was HoldenCaulfield, summer camp senior counselor for the junior trailblazers, black and brown children two weeks shy of first, second,and third grade. Nothing is as positive, as motivating a force withinone’s life as a school bus full of kids singing along to the localradio station blazing hip-hop and R&B. (Imagine this cherubicchorus riding upstate to Ini Kamoze’s “Here Comes the Hotstepper.”[“Muuur-derah!”]) My workday is filled with hazards like chocolatemelted sticky swim trunk pockets, insistent sunburn, and the assortedrah rah of parental unsupervision, but those bus rides back fromupstate water parks and pools were my favorite times working.Have you ever ridden in a cheesebus with ashy children asleepagainst you, staring at sudden trees — more numerous than projectwindows — blurring along the highways like confusion giving wayto doubt, the heady smell of dried chlorine and musty towelslulling you into the soft timbre of a Midwest falsetto? Tell mewhat it is to fall in love with a lightskin girl covering the IsleyBrothers. I was not two weeks into 21 years old. I had yetto wear a box cutter in my fifth pocket, or see a semi-automaticaimed at my center mass, to feel its dumbness against my spine.My life was uncertain, save for its unlikely length under my control,like the pilot who falls short of what he says, what he sayshe’s all about, all about. All my homeboys were still alive, justlike Aaliyah Dana Haughton, not yet an angel of the cruelest August,begging a boy, who may not be in the mood to learn what he thinkshe knows, to look beyond his world and try to find a place for her.","['living', 'coming of age', 'the body', 'time & brevity', 'activities', 'jobs & working', 'nature', 'summer', 'philosophy', 'social commentaries', 'cities & urban life', 'race & ethnicity']",292,1783
philosophy,Too Much,Tyler Ford,"do you remember the first time you were called annoying?how your breath stopped short in your chestthe way the light drained from your eyes, though you knew your cheeks were ablazethe way your throat tightened as you tried to form an argument that got lost on your tongue?your eyes never left the floor that day.you were 13.you’re 20 now, and i still see the light fade from your eyes when you talk about your interests for “too long,”apologies littering every other sentence,words trailing off a cliff you haven’t jumped from in 7 years.i could listen to you forever, though i know speaking for more than 3 uninterrupted minutes makes you anxious.all i want you to know is that you deserve to be heardfor 3 minutesfor 10 minutesfor 2 hours forever.there will be people who cannot handle your grace, your beauty, your wisdom, your heart;mostly because they can’t handle their own. but you will never beand have never been“too much.”","['living', 'coming of age', 'disappointment & failure', 'life choices', 'the mind', 'philosophy']",159,932
philosophy,"Kalymnos: November 29, 1968",Robert Lax,"1pavloslooking outto seaexplains:son costa,20, will becoming homewent with asponge caiquito nearbyislanda stormcame up:the boatwas smashed& sunkthe boysall gotashore& will becoming homein another caiqui 2 late at night i saw them costa & the others they’d saved the sponges too unloaded them first in burlap bags then hoisted them onto their backs trotted up the stone steps plodded up a steep hill at mid-night mid-night to the store-house 3 at 5 in the morning at the cafeneion the captain described the wreck: the boat had turned over & over in the water churning it like a propell-er 4 costa went by later on his motor-cycle (tall & sombre) riding like an indian 5 spiro (young gypsy) fishes off the dock when he isn’t climbing hills & selling blankets 6 what can you do? i get bored around the house the children crying fighting can’t sit all day in the cafeneion so i fish 7 after an hour he rolls in his lines teaches me two words in the romany tongue for ‘no fish’ (in the plural) 8 pat mos pat mos an gels an gels kaly mnos kaly mnos men kaly mnos kaly mnos men pat mos pat mos an gels an gels kaly mnos kaly mnos men 9 stergo has a tired eye bright but weary when he looks at you he looks into you his eye takes the place of what-ever you were think-ing 10 his café is near the customs house (& the pier) he keeps it open till late at night & opens again at 5 in the morn-ing if ever his cus-tomers find it closed they walk right by (& won’t drink coffee anyplace else) 11 in the endless city the end-less city the beg-gars are in one place the cops in an-other the fine people here & the poor people there (each has his parish each his precinct) in the endless endless endless city","['living', 'life choices', 'activities', 'travels & journeys', 'nature', 'seas', 'rivers', '& streams', 'philosophy', 'social commentaries', 'cities & urban life']",319,1692
philosophy,Harold’s Chicken Shack #86,Nate Marshall,"we’re trying to eliminate the shack. — Kristen Pierce, Harold’s CEO & daughter of founder Harold Pierce when i went to summer camp the white kids had a tendency to shorten names of important institutions. make Northwestern University into NU. international relations into IR. everybody started calling me Nate. before this i imagined myselfNathaniel A. maybe even N. Armstead to big up my granddad. i wrote my whole name on everything. eventually i started unintentionally introducing myself as Nate. it never occurred to me that they could escape the knowing of my name’s real length. as a shorty most the kids in my neighborhood couldn’t say my name.Mick-daniel, Nick-thaniel, MacDonnel shot across the courts like wild heaves toward the basket. the subconscious visual of a chicken shack seems a poor fit for national expansion. Harold’s Chicken is easier, sounds like Columbus’s flag stuck into a cup of cole slaw. shack sounds too much like home of poor people, like haven for weary like building our own.","['living', 'philosophy', 'social commentaries', 'race & ethnicity']",166,1010
philosophy,"beverly, huh.",Jamila Woods,you must bemade of money.your parentsmust have grownon trees.bet you’re blacktinged with green.bet you sleepon bags of it.bet your barbiesclimb it.bet you neverwanted.bet you neverhad to ask.bet you golf.bet you tennis.bet you got a summer house.bet you got a credit cardfor your 5th birthday. bet you playedwith bills for toys.bet you chew them up for dinner.bet you spit your black out like tobaccothat’s why you talk sobet you listen to green day.bet you ain’t never heard of al.bet your daddy wears a robearound the house.bet his hands are soft as a frog’s belly.bet your house is on a hill.bet the grass is freshly cut.bet you feel like a princess.bet the police protect your house.bet you know their first names. bet your house has a hundred rooms.bet a black lady comes to clean them.,"['living', 'coming of age', 'philosophy', 'social commentaries', 'cities & urban life', 'class', 'race & ethnicity']",133,791
philosophy,Sperm Oil,Yusef Komunyakaa,"Housed in a boom of blubber& bone, harpooned six times,the giant grew into a dynamohitched to six taut rope-linesskipping the boat across wavestoward the blurry lighthouse.It bled out a long silencebut men in oilskins laboredwith hydraulics of lighton water, walked its flank,& tore it down to a storeroomof Nantucket scrimshaw.Ballast stone or sledge? They bashed in the skull& lowered down the boyto haul up buckets of oilfor candles that burneda slow, clean, white glow.At ten, he was almost a manwhose feet sank into the waxymuck of ambergris. His sweatdripped into a long hour.Big as a barrel, the headechoed a temple nave.","['living', 'time & brevity', 'activities', 'jobs & working', 'nature', 'animals', 'seas', 'rivers', '& streams', 'philosophy']",101,628
philosophy,Hanging Fire,Audre Lorde,I am fourteen and my skin has betrayed me the boy I cannot live without still sucks his thumb in secret how come my knees are always so ashy what if I die before morning and momma's in the bedroom with the door closed. I have to learn how to dance in time for the next party my room is too small for me suppose I die before graduation they will sing sad melodies but finally tell the truth about me There is nothing I want to do and too much that has to be done and momma's in the bedroom with the door closed. Nobody even stops to think about my side of it I should have been on Math Team my marks were better than his why do I have to be the one wearing braces I have nothing to wear tomorrow will I live long enough to grow up and momma's in the bedroom with the door closed.,"['living', 'philosophy']",161,778
philosophy,Sonnet. To Tell the Truth,Alicia Ostriker,"To tell the truth, those brick Housing Authority buildings For whose loveliness no soul had planned, Like random dominoes stood, worn out and facing each other, Creating the enclosure that was our home. Long basement corridors connected one house to another And had a special smell, from old bicycles and baby carriages In the storage rooms. The elevators Were used by kissing teenagers. The playground—iron swingchains, fences, iron monkey bars, Iron seesaw handles, doubtless now rusted— Left a strong iron smell on my hands and in the autumn air And rang with cries. To me it is even precious Where they chased the local Mongoloid, yelling “Stupid Joey! Stupid Joey!” Now I’ve said everything nice I can about this.","['living', 'philosophy']",119,718
philosophy,The Giant Slide,Ted Kooser,"Beside the highway, the Giant Slide with its rusty undulations lifts out of the weeds. It hasn’t been used for a generation. The ticket booth tilts to that side where the nickels shifted over the years. A chain link fence keeps out the children and drunks. Blue morning glories climb halfway up the stairs, bright clusters of laughter. Call it a passing fancy, this slide that nobody slides down now. Those screams have all gone east on a wind that will never stop blowing down from the Rockies and over the plains, where things catch on for a little while, bright leaves in a fence, and then are gone.","['living', 'time & brevity', 'philosophy']",109,602
philosophy,Bewitched Playground,David Rivard,Each could picture probably with great care his brother drawing the corded string of a watered silk bag and mumbling to Basho above the keepsake pay your respects to mother's white hair now your eyebrows look a little white too,"['living', 'parenthood', 'philosophy', ""father's day""]",40,227
philosophy,Joy,Alan R. Shapiro,"What never comes when called. What hides when held. Guest most at home where least expected. Vagrant balm of Gilead. What, soon as here, becomes the body’s native ground and, soon as not, its banishment. Coming and going, indifferent, magisterial. My lovely daughter— walking me to the car to say goodbye the day I left to keep watch at my brother’s bedside— suddenly singing “I feel pretty, oh so pretty” as she raised her arms up in a loose oval over her head and pirouetted all along the walk. Savage and magisterial— the joy of it, the animal candor of each arabesque, each leaping turn and counterturn, her voice now wobbly with laughter, “And I pity any girl who isn’t me tonight.” Savagely beautiful, not so much like the lion that the camera freezes in mid- pounce, claws outstretched for the stumbling antelope, as like the herd escaping that the camera pans to, zig- zagging, swerving as one, their leaping strides now leaping higher, faster, even after, it seems, the fear subsides— after the fear and the relief they keep on running for nothing but the joy of running, though it could be any one of them is running from its fallen mother or father, sister or brother, across the wide savanna, under a bright sun into fresher grass.","['living', 'parenthood', 'arts & sciences', 'philosophy', 'theater & dance']",219,1243
philosophy,Elegy for Peter,Bruce Weigl,"That night we drank warm whiskey in our parked car beyond woods now lost to the suburbs, I fell in love with you. What waited was the war like a bloody curtain, and a righteous moment when the lovely boy’s spine was snapped, then the long falling into hell. But lately, you’ve been calling me back through the years of bitter silence to tell me of another river of blood and of the highland’s howl at dusk of human voices blasted into ecstasy. That night in sweet Lorain we drank so long and hard we raised ourselves above the broken places, mill fires burning red against the sky. Why is there no end to this unraveling.","['living', 'philosophy']",116,621
philosophy,The Campus on the Hill,W. D. Snodgrass,"Up the reputable walks of old established trees They stalk, children of the nouveaux riches; chimes Of the tall Clock Tower drench their heads in blessing: “I don't wanna play at your house; I don't like you any more.” My house stands opposite, on the other hill, Among meadows, with the orchard fences down and falling; Deer come almost to the door. You cannot see it, even in this clearest morning. White birds hang in the air between Over the garbage landfill and those homes thereto adjacent, Hovering slowly, turning, settling down Like the flakes sifting imperceptibly onto the little town In a waterball of glass. And yet, this morning, beyond this quiet scene, The floating birds, the backyards of the poor, Beyond the shopping plaza, the dead canal, the hillside lying tilted in the air, Tomorrow has broken out today: Riot in Algeria, in Cyprus, in Alabama; Aged in wrong, the empires are declining, And China gathers, soundlessly, like evidence. What shall I say to the young on such a morning?— Mind is the one salvation?—also grammar?— No; my little ones lean not toward revolt. They Are the Whites, the vaguely furiously driven, who resist Their souls with such passivity As would make Quakers swear. All day, dear Lord, all day They wear their godhead lightly. They look out from their hill and say, To themselves, “We have nowhere to go but down; The great destination is to stay.” Surely the nations will be reasonable; They look at the world—don't they?—the world's way? The clock just now has nothing more to say.","['living', 'activities', 'school & learning', 'philosophy', 'social commentaries', 'history & politics', 'money & economics']",263,1532
philosophy,The Children,Mark Jarman,"The children are hiding among the raspberry canes. They look big to one another, the garden small. Already in their mouths this soft fruit That lasts so briefly in the supermarket Tastes like the past. The gritty wall, Behind the veil of leaves, is hollow. There are yellow wasps inside it. The children know. They know the wall is hard, although it hums. They know a lot and will not forget it soon. When did we forget? But we were never Children, never found where they were hiding And hid with them, never followed The wasp down into its nest With a fingertip that still tingles. We lie in bed at night, thinking about The future, always the future, always forgetting That it will be the past, hard and hollow, Veiled and humming, soon enough.","['living', 'time & brevity', 'nature', 'trees & flowers', 'philosophy']",135,746
philosophy,Dressing My Daughters,Mark Jarman,"One girl a full head taller Than the other—into their Sunday dresses. First, the slip, hardly a piece of fabric, Softly stitched and printed with a bud. I’m not their mother, and tangle, then untangle The whole cloth—on backwards, have to grab it Round their necks. But they know how to pull Arms in, a reflex of being dressed, And also, a child’s faith. The mass of stuff That makes the Sunday frocks collapses In my hands and finds its shape, only because They understand the drape of it— These skinny keys to intricate locks. The buttons are a problem For a surgeon. How would she connect These bony valves and stubborn eyelets? The filmy dress revolves in my blind fingers. The slots work one by one. And when they’re put together, Not like puppets or those doll-saints That bring tears to true believers, But living children, somebody’s real daughters, They do become more real. They say, “Stop it!” and “Give it back!” And “I don’t want to!” They’ll kiss A doll’s hard features, whispering, “I’m sorry.” I know just why my mother Used to worry. Your clothes don’t keep You close—it’s nakedness. Clad in my boots and holster, I would roam with my six-gun buddies. We dealt fake death to one another, Fell and rolled in filth and rose, Grimy with wounds, then headed home. But Sunday ... what was that tired explanation Given for wearing clothes that Scratched and shone and weighed like a slow hour? That we should shine—in gratitude. So, I give that explanation, undressing them, And wait for the result. After a day like Sunday, such a long one, When they lie down, half-dead, To be undone, they won’t help me. They cry, “It’s not my fault.”","['living', 'parenthood', 'philosophy', ""father's day""]",292,1648
philosophy,How Things Work,Gary Soto,"Today it’s going to cost us twenty dollars To live. Five for a softball. Four for a book, A handful of ones for coffee and two sweet rolls, Bus fare, rosin for your mother’s violin. We’re completing our task. The tip I left For the waitress filters down Like rain, wetting the new roots of a child Perhaps, a belligerent cat that won’t let go Of a balled sock until there’s chicken to eat. As far as I can tell, daughter, it works like this: You buy bread from a grocery, a bag of apples From a fruit stand, and what coins Are passed on helps others buy pencils, glue, Tickets to a movie in which laughter Is thrown into their faces. If we buy a goldfish, someone tries on a hat. If we buy crayons, someone walks home with a broom. A tip, a small purchase here and there, And things just keep going. I guess.","['living', 'activities', 'jobs & working', 'philosophy', 'social commentaries', 'money & economics']",157,808
philosophy,Ancestral,Archibald MacLeish,"The star dissolved in evening—the one star The silently and night O soon now, soon And still the light now and still now the large Relinquishing and through the pools of blue Still, still the swallows and a wind now and the tree Gathering darkness: I was small. I lay Beside my mother on the grass, and sleep Came— slow hooves and dripping with the dark The velvet muzzles, the white feet that move In a dream water and O soon now soon Sleep and the night. And I was not afraid. Her hand lay over mine. Her fingers knew Darkness,—and sleep—the silent lands, the far Far off of morning where I should awake.","['living', 'nature', 'stars', 'planets', 'heavens', 'philosophy']",114,606
philosophy,The Burnt Child,W. S. Merwin,Matches among other things that were not allowed never would be lying high in a cool blue box that opened in other hands and there they all were bodies clean and smooth blue heads white crowns white sandpaper on the sides of the box scoring fire after fire gone before I could hear the scratch and flare when they were over and catch the smell of the striking I knew what the match would feel like lighting when I was very young a fire engine came and parked in the shadow of the big poplar tree on Fourth Street one night keeping its engine running pumping oxygen to the old woman in the basement when she died the red lights went on burning,"['living', 'philosophy']",123,642
philosophy,Bed in Summer,Robert Louis Stevenson,"In winter I get up at night And dress by yellow candle-light. In summer, quite the other way, I have to go to bed by day. I have to go to bed and see The birds still hopping on the tree, Or hear the grown-up people's feet Still going past me in the street. And does it not seem hard to you, When all the sky is clear and blue, And I should like so much to play, To have to go to bed by day?","['living', 'nature', 'summer', 'philosophy']",86,390
philosophy,At the Sea-Side,Robert Louis Stevenson,When I was down beside the sea A wooden spade they gave to me To dig the sandy shore. My holes were empty like a cup. In every hole the sea came up Till it could come no more.,"['living', 'nature', 'summer', 'philosophy']",39,175
philosophy,The Amenities,Heather McHugh,"I owe you an explanation. My first memory isn’t your own of an empty box. My babyhood cabinets held a countlessness of cakes, my backyard rotted into apple glut, windfalls of money-tree, mouthfuls of fib. At puberty I liked the locks, I was the one who made them fast. The yelling in our hallways was about lost money, or lost love, but not lost life. Or so I see it now: in those days I romanticized a risk (I thought I’d die in the alcoholic automobile, die at the hands of nerveless dentistry). Small hearts were printed in the checkbook; when my parents called me dear, they meant expensive. Where were you in all that time? Out looking for your father’s body? Making for your mother’s room? I got my A’s in English, civics, sweetness and light; you got black eyes, and F’s, and nowhere fast. By 1967 when we met (if you could call it making an acquaintance, rape) I was a mal-adjusted gush, a sucker for placebos. Walking home from Central Square, I came to have the good girl’s petty dread: the woman to whose yard you dragged me might detect us, and be furious. More than anything else I wanted no one mad at me. (Propriety, or was it property, I thought to guard: myself I gave away.) And as for you, you had the shakes, were barely seventeen yourself, too raw to get it up (I said don’t be afraid, afraid of what might happen if you failed). And afterwards, in one of those moments it’s hard to tell (funny from fatal) you did a terrible civility: you told me thanks. I’ll never forget that moment all my life. It wasn’t until then, as you were sheathing it to run, I saw the knife.","['living', 'the body', 'nature', 'philosophy', 'social commentaries', 'crime & punishment']",298,1591
philosophy,Adolescence-II,Rita Dove,"Although it is night, I sit in the bathroom, waiting. Sweat prickles behind my knees, the baby-breasts are alert. Venetian blinds slice up the moon; the tiles quiver in pale strips. Then they come, the three seal men with eyes as round As dinner plates and eyelashes like sharpened tines. They bring the scent of licorice. One sits in the washbowl, One on the bathtub edge; one leans against the door. “Can you feel it yet?” they whisper. I don’t know what to say, again. They chuckle, Patting their sleek bodies with their hands. “Well, maybe next time.” And they rise, Glittering like pools of ink under moonlight, And vanish. I clutch at the ragged holes They leave behind, here at the edge of darkness. Night rests like a ball of fur on my tongue.","['living', 'coming of age', 'philosophy']",135,751
