Label,Title,Poet,Poem,Tags,Poem_word_count,Poem_char_count
philosophy,Playroom,Mary Barnard,"Wheel of sorrow, centerless. Voices, sad without cause, slope upward, expiring on grave summits. Mournfulness of muddy playgrounds, raw smell of rubbers and wrapped lunches when little girls stand in a circle singing of windows and of lovers. Hearing them, no one could tell why they sing sadly, but there is in their voices the pathos of all handed-down garments hanging loosely on small bodies.","['living', 'coming of age', 'philosophy']",65,396
philosophy,The Picture of Little T. C. in a Prospect of Flowers,Andrew Marvell,"See with what simplicity This nymph begins her golden days! In the green grass she loves to lie, And there with her fair aspect tames The wilder flowers, and gives them names: But only with the roses plays; And them does tell What colour best becomes them, and what smell. Who can foretell for what high cause This Darling of the Gods was born! Yet this is she whose chaster laws The wanton Love shall one day fear, And, under her command severe, See his bow broke and ensigns torn. Happy, who can Appease this virtuous enemy of man! O, then let me in time compound, And parley with those conquering eyes; Ere they have tried their force to wound, Ere, with their glancing wheels, they drive In triumph over hearts that strive, And them that yield but more despise. Let me be laid, Where I may see thy glories from some shade. Meantime, whilst every verdant thing Itself does at thy beauty charm, Reform the errors of the spring; Make that the tulips may have share Of sweetness, seeing they are fair; And roses of their thorns disarm: But most procure That violets may a longer age endure. But, O young beauty of the woods, Whom Nature courts with fruits and flowers, Gather the flowers, but spare the buds; Lest Flora angry at thy crime, To kill her infants in their prime, Do quickly make the example yours; And, ere we see, Nip in the blossom all our hopes and thee.","['living', 'infancy', 'nature', 'landscapes & pastorals', 'philosophy']",252,1370
philosophy,Young Love,Andrew Marvell,"Come, little infant, love me now, While thine unsuspected years Clear thine agèd father’s brow From cold jealousy and fears. Pretty, surely, ’twere to see By young love old time beguiled, While our sportings are as free As the nurse’s with the child. Common beauties stay fifteen; Such as yours should swifter move, Whose fair blossoms are too green Yet for lust, but not for love. Love as much the snowy lamb, Or the wanton kid, does prize, As the lusty bull or ram, For his morning sacrifice. Now then love me: time may take Thee before thy time away: Of this need we’ll virtue make, And learn love before we may. So we win of doubtful fate; And if good she to us meant, We that good shall antedate, Or, if ill, that ill prevent. Thus as kingdoms, frustrating Other titles to their crown, In the cradle crown their king, So all foreign claims to drown, So, to make all rivals vain, Now I crown thee with my love: Crown me with thy love again, And we both shall monarchs prove.","['living', 'coming of age', 'parenthood', 'philosophy']",182,978
philosophy,Song for Pythagoras,Dannie Abse,"White coat and purple coat a sleeve from both he sews. That white is always stained with blood, that purple by the rose. And phantom rose and blood most real compose a hybrid style; white coat and purple coat few men can reconcile. White coat and purple coat can each be worn in turn but in the white a man will freeze and in the purple burn.","['arts & sciences', 'philosophy', 'poetry & poets']",67,342
philosophy,The Bitterness of Children,Thomas Lux,"Foreseeing typographical errors on their gravestones, the children from infancy—are bitter. Little clairvoyants, blond, in terror. Foreseeing the black and yellow room behind the eyelids, the children are bitter—from infancy. The blue egg of thirst: say hello. Foreseeing the lower lips of glaciers sliding toward their own lips, the children from infancy—are bitter. Them, rats, snakes: the chased and chasers. Foreseeing a dust-filled matchbox, the heart, the temples’ temples closing, the children are bitter—from infancy. From the marrow in the marrow: the start.","['living', 'disappointment & failure', 'infancy', 'philosophy']",83,567
philosophy,The Copper Beech,Marie Howe,"Immense, entirely itself, it wore that yard like a dress, with limbs low enough for me to enter it and climb the crooked ladder to where I could lean against the trunk and practice being alone. One day, I heard the sound before I saw it, rain fell darkening the sidewalk. Sitting close to the center, not very high in the branches, I heard it hitting the high leaves, and I was happy, watching it happen without it happening to me.","['nature', 'trees & flowers', 'arts & sciences', 'philosophy']",81,431
philosophy,Vietnam,Michael Collier,"The shape of it bending like an eel or disfigured quarter moon, pink and green and brown, like a rainbow trout. The wall along my bed covered with the map I cut from the newspaper, and next to it the fishing calendar from Abonauder’s Texaco. The square cages of days with their numerals and effigies of moon and fish shaded to indicate the shape of the moon, the hunger of the fish. The white bread stripped of its crust, dampened, then dusted with flour, compressed into a tight ball, wrapped in foil and chilled all night. A piece of it pressed and shaped on the tip of an Eagle Claw hook, then lowered into the nesting holes of blue gill. The plastic bobber floating on the surface like a silent doorbell. A whole world of cause and effect, framed day-by-day and week-by-week. The passage of time as a kind of game in which I transferred numbers from the newspaper to the calendar. The body counts and their categories of NVRA, Marines, Montagnards. And each morning I put a bold X through the previous day not to erase or forget it but to connect the corners, make four triangles of the square. And it was rare if not impossible to catch the blue gill that swam and swam around the tidy pebble craters of their nests, or coax them out except in hostile swerves and feints toward the bait that hung like a balloon of gravity over their homes, a suspicious egg pouch or cocoon, something a storm might have dislodged from the bank and blown like a feared gift into the water, a thing swallowed whole then run with until the line played out and the hook set fast.","['living', 'activities', 'sports & outdoor activities', 'philosophy', 'social commentaries', 'war & conflict']",289,1564
philosophy,Drill,Michael Collier,"When the fire bell rang its two short, one long electric signal, the boys closest to the wall of windows had to raise the blinds and close the sashes, and then join the last of our line as it snaked out the classroom onto the field of asphalt where we stood, grade-by-grade, until the principal appeared with her gold Timex. We learned early that catastrophe must always be attended in silence, that death prefers us orderly and ordered, and that rules will save us from the chaos of our fear, so that even if we die, we die together, which was the calm almost consoling thought I had each time the yellow C.D. siren wailed and we would tuck ourselves beneath our sturdy desktops. Eyes averted from the windows, we’d wait for the drill to pass or until the nun’s rosary no longer clicked and we could hear her struggling to free herself from the leg-well of her desk, and then her call for us to rise and, like herself, brush off the dust gathered on our clothes. And then the lessons resumed. No thought of how easily we interred ourselves, though at home each would dream the mushroom cloud, the white cap of apocalypse whose funnel stem sucked glass from windows, air from lungs, and made all these rehearsals the sad and hollow gestures that they were, for we knew it in our bones that we would die, curled in a last defense— head on knees, arms locked around legs— the way I’ve seen it since in nursing homes and hospices: forms bedsheets can’t hide, as if in death the body takes on the soul’s compact shape, acrobatic, posed to tumble free of the desktop or bed and join the expanse and wide scatter of debris.","['living', 'activities', 'school & learning', 'philosophy', 'social commentaries', 'history & politics', 'war & conflict']",297,1617
philosophy,Branch Library,Edward Hirsch,"I wish I could find that skinny, long-beaked boy who perched in the branches of the old branch library. He spent the Sabbath flying between the wobbly stacks and the flimsy wooden tables on the second floor, pecking at nuts, nesting in broken spines, scratching notes under his own corner patch of sky. I'd give anything to find that birdy boy again bursting out into the dusky blue afternoon with his satchel of scrawls and scribbles, radiating heat, singing with joy.","['living', 'activities', 'indoor activities', 'school & learning', 'arts & sciences', 'philosophy', 'poetry & poets', 'social commentaries', 'cities & urban life']",81,469
philosophy,A Barred Owl,Richard Wilbur,"The warping night air having brought the boom Of an owl’s voice into her darkened room, We tell the wakened child that all she heard Was an odd question from a forest bird, Asking of us, if rightly listened to, “Who cooks for you?” and then “Who cooks for you?” Words, which can make our terrors bravely clear, Can also thus domesticate a fear, And send a small child back to sleep at night Not listening for the sound of stealthy flight Or dreaming of some small thing in a claw Borne up to some dark branch and eaten raw.","['living', 'nature', 'animals', 'philosophy']",100,523
philosophy,As Children Know,Jimmy Santiago Baca,"Elm branches radiate green heat, blackbirds stiffly strut across fields. Beneath bedroom wood floor, I feel earth— bread in an oven that slowly swells, simmering my Navajo blanket thread-crust as white-feathered and corn-tasseled Corn Dancers rise in a line, follow my calf, vanish in a rumple and surface at my knee-cliff, chanting. Wearing shagged buffalo headgear, Buffalo Dancer chases Deer Woman across Sleeping Leg mountain. Branches of wild rose trees rattle seeds. Deer Woman fades into hills of beige background. Red Bird of my heart thrashes wildly after her. What a stupid man I have been! How good to let imagination go, step over worrisome events, those hacked logs tumbled about in the driveway. Let decisions go! Let them blow like school children’s papers against the fence, rattling in the afternoon wind. This Red Bird of my heart thrashes within the tidy appearance I offer the world, topples what I erect, snares what I set free, dashes what I’ve put together, indulges in things left unfinished, and my world is left, as children know, left as toys after dark in the sandbox.","['living', 'disappointment & failure', 'philosophy']",182,1096
philosophy,Between the Wars,Robert Hass,"When I ran, it rained. Late in the afternoon— midsummer, upstate New York, mornings I wrote, read Polish history, and there was a woman whom I thought about; outside the moody, humid American sublime—late in the afternoon, toward sundown, just as the sky was darkening, the light came up and redwings settled in the cattails. They were death's idea of twilight, the whole notes of a requiem the massed clouds croaked above the somber fields. Lady of eyelashes, do you hear me? Whiteness, otter's body, coolness of the morning, rubbed amber and the skin's salt, do you hear me? This is Poland speaking, “era of the dawn of freedom,” nineteen twenty-two.","['living', 'nature', 'landscapes & pastorals', 'philosophy', 'social commentaries', 'history & politics', 'war & conflict']",111,652
philosophy,Fragment of a Women from Kos,Susan Mitchell,"At first all you see are the folds of drapery, high grass close together, swaying beads you parted as a child, field behind the house, then river. Sky. You were told finches lived there, red- winged, tipsy, upside down their hold on the reeds, even so they sang, trilling over and over your outstretched hands song poured like seeds from a basket or from a bowl, water. There was a woman, young, beautiful—you used to hug her from behind, closing your hands over the cry of surprise she gave out like perfume. Now here she is, rising from the dead landscape of memory, just this fragment of her, still kneeling.","['living', 'time & brevity', 'arts & sciences', 'painting & sculpture', 'philosophy']",110,611
philosophy,I Would Like to Describe,Zbigniew Herbert,I would like to describe the simplest emotion joy or sadness but not as others do reaching for shafts of rain or sun I would like to describe a light which is being born in me but I know it does not resemble any star for it is not so bright not so pure and is uncertain I would like to describe courage without dragging behind me a dusty lion and also anxiety without shaking a glass full of water to put it another way I would give all metaphors in return for one word drawn out of my breast like a rib for one word contained within the boundaries of my skin but apparently this is not possible and just to say—I love I run around like mad picking up handfuls of birds and my tenderness which after all is not made of water asks the water for a face and anger different from fire borrows from it a loquacious tongue so is blurred so is blurred in me what white-haired gentlemen separated once and for all and said this is the subject and this is the object we fall asleep with one hand under our head and with the other in a mound of planets our feet abandon us and taste the earth with their tiny roots which next morning we tear out painfully,"['arts & sciences', 'philosophy', 'poetry & poets']",226,1145
philosophy,How We Were Introduced,Zbigniew Herbert,—for perfidious protectors I was playing in the street no one paid attention to me as I made forms out of sand mumbling Rimbaud under my breath once an elderly gentleman overheard it —little boy you are a poet just now we are organizing a grass-roots literary movement he stroked my dirty head gave me a large lollypop and even bought clothes in the protective coloring of youth I didn’t have such a splendid suit since first communion short trousers and a wide sailor’s collar black patent leather shoes with a buckle white knee-high socks the elderly gentleman took me by the hand and led the way to the ball other boys were there also in short trousers carefully shaven shuffling their feet —well boys now it’s time to play why are you standing in the corners asked the elderly gentleman —make a circle holding hands but we didn’t want tag or blindman’s buff we had enough of the elderly gentleman we were very hungry so we were seated promptly around a large table given lemonade and pieces of cake now disguised as adults with deep voices the boys got up they praised us or slapped us on our hands we didn’t hear anything didn’t feel anything staring with great eyes at the piece of cake that kept melting in our hot hands and this sweet taste the first in our lives disappeared inside our dark sleeves,"['living', 'arts & sciences', 'philosophy', 'poetry & poets']",237,1307
philosophy,End of Winter,Louise Glück,"Over the still world, a bird calls waking solitary among black boughs. You wanted to be born; I let you be born. When has my grief ever gotten in the way of your pleasure? Plunging ahead into the dark and light at the same time eager for sensation as though you were some new thing, wanting to express yourselves all brilliance, all vivacity never thinking this would cost you anything, never imagining the sound of my voice as anything but part of you— you won't hear it in the other world, not clearly again, not in birdcall or human cry, not the clear sound, only persistent echoing in all sound that means good-bye, good-bye— the one continuous line that binds us to each other.","['living', 'parenthood', 'philosophy']",124,682
philosophy,The Raspberry Room,Karin Gottshall,"It was solid hedge, loops of bramble and thorny as it had to be with its berries thick as bumblebees. It drew blood just to get there, but I was queen of that place, at ten, though the berries shook like fists in the wind, daring anyone to come in. I was trying so hard to love this world—real rooms too big and full of worry to comfortably inhabit—but believing I was bornto live in that cloistered green bower: the raspberry patch in the back acre of my grandparents’ orchard. I was cross- stitched and beaded by its fat, dollmaker’s needles. The effort of sliding under the heavy, spiked tangles that tore my clothes and smeared me with juice was rewarded with space, wholly mine, a kind of room out of the crush of the bushes with a canopy of raspberry dagger-leaves and a syrup of sun and birdsong. Hours would pass in the loud buzz of it, blood made it mine—the adventure of that red sting singing down my calves, the place the scratches brought me to: just space enough for a girl to lie down.","['living', 'activities', 'sports & outdoor activities', 'nature', 'trees & flowers', 'philosophy']",187,1000
philosophy,Drawn Curtains,Edmond Jabès,"""Dullness of words where God speaks. A dark which feels good. Drawn curtains. On the dark page lines continue the crease and the dream, the space between."" -Reb Rissel 1 ""Hope: the following page. Do not close the book."" ""I have turned all the pages of the book without finding hope."" ""Perhaps hope is the book."" 2 ""In my dialogues there are no answers. But sometimes a question is the flash of an answer. ""My route riddled with crystals."" -Reb Librad And Yukel said: ""If an answer were possible death would not travel alongside life, life would not have a shadow. The universe would be light. ""Contradiction is the scream of a soul drawn and quartered by the moment. Did not Reb Sedra write: 'Here is grain for your field: a grain of life, a grain of death. The grain of life will nourish your death, the grain of death feed your life.'"" (""Death will get the better of me. God can only help me in the void.""","['arts & sciences', 'philosophy']",168,908
philosophy,"Slam, Dunk, & Hook",Yusef Komunyakaa,"Fast breaks. Lay ups. With Mercury's Insignia on our sneakers, We outmaneuvered the footwork Of bad angels. Nothing but a hot Swish of strings like silk Ten feet out. In the roundhouse Labyrinth our bodies Created, we could almost Last forever, poised in midair Like storybook sea monsters. A high note hung there A long second. Off The rim. We'd corkscrew Up & dunk balls that exploded The skullcap of hope & good Intention. Lanky, all hands & feet...sprung rhythm. We were metaphysical when girls Cheered on the sidelines. Tangled up in a falling, Muscles were a bright motor Double-flashing to the metal hoop Nailed to our oak. When Sonny Boy's mama died He played nonstop all day, so hard Our backboard splintered. Glistening with sweat, We rolled the ball off Our fingertips. Trouble Was there slapping a blackjack Against an open palm. Dribble, drive to the inside, & glide like a sparrow hawk. Lay ups. Fast breaks. We had moves we didn't know We had. Our bodies spun On swivels of bone & faith, Through a lyric slipknot Of joy, & we knew we were Beautiful & dangerous.","['living', 'coming of age', 'activities', 'sports & outdoor activities', 'philosophy']",189,1076
philosophy,"Song: “When that I was and a little tiny boy (With hey, ho, the wind and the rain)”",William Shakespeare,"(from Twelfth Night) When that I was and a little tiny boy, With hey, ho, the wind and the rain, A foolish thing was but a toy, For the rain it raineth every day. But when I came to man’s estate, With hey, ho, the wind and the rain, ’Gainst knaves and thieves men shut their gate, For the rain it raineth every day. But when I came, alas! to wive, With hey, ho, the wind and the rain, By swaggering could I never thrive, For the rain it raineth every day. But when I came unto my beds, With hey, ho, the wind and the rain, With toss-pots still had drunken heads, For the rain it raineth every day. A great while ago the world begun, With hey, ho, the wind and the rain, But that’s all one, our play is done, And we’ll strive to please you every day.","['living', 'time & brevity', 'nature', 'weather', 'philosophy']",151,749
philosophy,To Fool or Knave,Ben Jonson,"Thy praise or dispraise is to me alike: One doth not stroke me, nor the other strike.","['living', 'disappointment & failure', 'life choices', 'arts & sciences', 'philosophy', 'social commentaries']",17,85
philosophy,Questionnaire,Charles Bernstein,"Directions: For each pair of sentences, circle the letter, a or b, that best expresses your viewpoint. Make a selection from each pair. Do not omit any items. 1.a) The body and the material things of the world are the key to any knowledge we can possess. b) Knowledge is only possible by means of the mind or psyche. 2.a) My life is largely controlled by luck and chance. b) I can determine the basic course of my life. 3.a) Nature is indifferent to human needs. b) Nature has some purpose, even if obscure. 4.a) I can understand the world to a sufficient extent. b) The world is basically baffling. 5.a) Love is the greatest happiness. b) Love is illusionary and its pleasures transient. 6.a) Political and social action can improve the state of the world. b) Political and social action are fundamentally futile. 7.a) I cannot fully express my most private feelings. b) I have no feelings I cannot fully express. 8.a) Virtue is its own reward. b) Virtue is not a matter of rewards. 9.a) It is possible to tell if someone is trustworthy. b) People turn on you in unpredictable ways. 10.a) Ideally, it would be most desirable to live in a rural area. b) Ideally, it would be most desirable to live in an urban area. 11.a) Economic and social inequality is the greatest social evil. b) Totalitarianism is the greatest social evil. 12.a) Overall, technology has been beneficial to human beings. b) Overall, technology has been harmful to human beings. 13.a) Work is the potential source of the greatest human fulfillment. b) Liberation from work should be the goal of any movement for social improvement. 14.a) Art is at heart political in that it can change our perception of reality. b) Art is at heart not political because it can change only consciousness and not events.","['life choices', 'arts & sciences', 'language & linguistics', 'philosophy', 'social commentaries', 'history & politics', 'money & economics']",311,1773
philosophy,"Quaker Meeting, The Sixties",Robin Becker,"Seeing my friend’s son in his broad-brimmed hat and suspenders, I think of the Quakers who lectured us on nonviolent social action every week when I was a child. In the classrooms we listened to those who would not take up arms, who objected, who had accepted alternative service in distant work camps and showed slides of hospitals they helped to build. On Wednesdays, in Meeting for Worship, when someone rose to speak, all the energy in the room flew inside her mouth, empowering her to tell what she had seen on her brief encounter with the divine: sometimes, a parable, a riddle, a kindness. The fall that we were seventeen, we scuffed our loafers on the gravelly path from the Meetinghouse, while maple and elm leaves sailed around our shoulders like tiny envelopes, our futures sealed inside. Despite the war in Vietnam, I felt safer than I ever would again. Perhaps those aged, protective trees had cast a spell on us, or maybe the nonviolent Quaker God had set up a kingdom right there— suburban Philadelphia. Looking back, I see how good deeds and thoughts climbed with us to the attic room for Latin, descended to the gym for sports, where we hung from the praiseworthy scaffolds of righteous behavior. We prepared to leave for college, armed with the language of the American Friends and the memories of Thanksgiving dinners we’d cooked for the unfortunates: borrowing our parents’ cars to drive downtown to the drop-off point, racing back to play our last field hockey match. Grim center forwards shook hands before the whistle, the half-backs’ knee-pads strapped on tight; one varsity team vanquished another.","['living', 'coming of age', 'activities', 'school & learning', 'sports & outdoor activities', 'philosophy', 'social commentaries', 'war & conflict', 'thanksgiving']",275,1623
philosophy,Digging in a Footlocker,Walter McDonald,"Crouched before dismantled guns, we found war souvenirs our uncle padlocked in the attic, a brittle latch easily pried off. Stiff uniforms on top, snapshots of soldiers young as our cousins, a velvet box of medals as if he fought all battles in World War II. Bayonets, machetes, a folded flag, two hand grenades with missing pins. We picked up teeth like pennies, loose, as if tossed in, a piece of something dark and waxy like a fig, curved like a question mark, a human ear. We touched dried pieces of cloth stuck to curved bones and held them to the light, turning them over and over, wondering how did uncles learn to kill, what would happen when we grew up.","['living', 'philosophy', 'social commentaries', 'war & conflict', 'heroes & patriotism']",121,662
