Label,Title,Poet,Poem,Tags,Poem_word_count,Poem_char_count
philosophy,Tomorrow,Dennis O'Driscoll,"I Tomorrow I will start to be happy. The morning will light up like a celebratory cigar. Sunbeams sprawling on the lawn will set dew sparkling like a cut-glass tumbler of champagne. Today will end the worst phase of my life. I will put my shapeless days behind me, fencing off the past, as a golden rind of sand parts slipshod sea from solid land. It is tomorrow I want to look back on, not today. Tomorrow I start to be happy; today is almost yesterday. II Australia, how wise you are to get the day over and done with first, out of the way. You have eaten the fruit of knowledge, while we are dithering about which main course to choose. How liberated you must feel, how free from doubt: the rise and fall of stocks, today’s closing prices are revealed to you before our bidding has begun. Australia, you can gather in your accident statistics like a harvest while our roads still have hours to kill. When we are in the dark, you have sagely seen the light. III Cagily, presumptuously, I dare to write 2018. A date without character or tone. 2018. A year without interest rates or mean daily temperature. Its hit songs have yet to be written, its new-year babies yet to be induced, its truces to be signed. Much too far off for prophecy, though one hazards a tentative guess—a so-so year most likely, vague in retrospect, fizzling out with the usual end-of-season sales; everything slashed: your last chance to salvage something of its style.","['living', 'life choices', 'time & brevity', 'arts & sciences', 'humor & satire', 'philosophy', 'social commentaries']",261,1444
philosophy,The School Where I Studied,Yehuda Amichai,"I passed by the school where I studied as a boy and said in my heart: here I learned certain things and didn't learn others. All my life I have loved in vain the things I didn't learn. I am filled with knowledge, I know all about the flowering of the tree of knowledge, the shape of its leaves, the function of its root system, its pests and parasites. I'm an expert on the botany of good and evil, I'm still studying it, I'll go on studying till the day I die. I stood near the school building and looked in. This is the room where we sat and learned. The windows of a classroom always open to the future, but in our innocence we thought it was only landscape we were seeing from the window. The schoolyard was narrow, paved with large stones. I remember the brief tumult of the two of us near the rickety steps, the tumult that was the beginning of a first great love. Now it outlives us, as if in a museum, like everything else in Jerusalem.","['living', 'coming of age', 'time & brevity', 'activities', 'school & learning', 'philosophy', 'graduation']",183,944
philosophy,Mind ? Body,Gregory Djanikian,"How do they survive, riven as they are, the one undoing the other's desire? Tell the body to outrun the mind, and the mind smirks, whispering too loudly this way this way, blocking all the exits. And the body, luxurious sensualist by pool side or in bed, doesn't it hear the mind's impatient machinery ticking it's time it's time? And only in our mind's eye, as we're fond of saying, someone else's body leaping nimbly in jetés of thought, or revealing to us Act V, scene iii in one gestural flourish, body and mind beautifully synchronous. Oh, the mind is eely, slipping out of its puzzle boxes, loving its own wit. And the earnest body: speak of it with the least irony, and already you've begun to unnerve it. Better to let them have their way, forgetting about them both until they meet again sometime as if for the first time in library or steam room ready to shake hello or lead you to whatever door there is and always the two sets of stairs.","['the body', 'the mind', 'nature', 'arts & sciences', 'philosophy']",175,949
philosophy,Kolmrden Zoo,Bill Coyle,"Over our heads, trailing a wake of air and an enormous shadow as it passed, the falcon glided to its trainer’s fist and settled like a loaded weapon there. Then, while she fed the bird bit after bit of... what? rabbit? the trainer gave her talk: These birds, she said, prey on the small and weak, adding for the children’s benefit that this, though it seems cruel, is really good since otherwise the other rabbits, mice, squirrels, what have you, would run out of space and die of illness or a lack of food. I know what she was trying to get across, and I don’t doubt it would be healthier if we were more familiar than we are with how the natural world draws life from loss; and granted, nothing is more natural than death incarnate falling from the sky; and granted, it is better some should die, however agonizingly, than all. Still, to teach children this is how things go is one thing, to insist that it is good is something else—it is to make a god of an unsatisfactory status quo, this vicious circle that the clock hands draw and quarter, while the serpent bites its tail, or eats the dust, or strikes at someone’s heel, or winds up comprehended by a claw. She launched the bird again. We watched it climb out of the amphitheatre, headed toward the darkened spires of a nearby wood, then bank, then angle toward us one last time.","['activities', 'school & learning', 'nature', 'animals', 'arts & sciences', 'philosophy', 'social commentaries', 'war & conflict']",247,1337
philosophy,Less,Jason Guriel,"—cooked by crooked math—is more than enough. For example, the rough patch on the roof of the mouth we tongue— a light fixture, chandelier of texture—is so much more than mere canker. And when fingering the clasp on Father's snuffbox, his fine initials grate against our fingerprints' grain like an engraved last gasp. Less, being more, makes of the tectonic plates of molehills a mountain ridge the way the stark plain of the White Album's sleeve raises the Beatles' embossed logo to the level of topography— the way tiny things can't help being, next to nothing, something— the unanticipated mole that makes a one-night stand's upturned ass, the last leaf out on a limb, the little going a long way.","['living', 'time & brevity', 'arts & sciences', 'philosophy']",120,700
philosophy,Long Finger Poem,Jin Eun-Young,I’m working on my poems and working with my fingers not my head. Because my fingers are the farthest stretching things from me. Look at the tree. Like its longest branch I touch the evening’s quiet breathing. Sounds of rain. The crackling heat from other trees. The tree points everywhere. The branches can’t reach to their roots though. Growing longer they grow weaker also. Can’t make use of water. Rain falls. But I’m working with these farthest stretching things from me. Along my fingertips bare shoots of days then years unfurl in the cold air.,"['the body', 'nature', 'trees & flowers', 'arts & sciences', 'philosophy', 'poetry & poets']",95,550
philosophy,Fact,Rae Armantrout,"Operation Phantom Fury. * * * The full force of the will to live is fixed on the next occasion: someone coming with a tray, someone calling a number. * * * Each material fact is a pose, an answer waiting to be chosen. ""Just so,"" it says. ""Ask again!""","['arts & sciences', 'humor & satire', 'philosophy', 'social commentaries']",50,250
philosophy,And as in Alice,Mary Jo Bang,"Alice cannot be in the poem, she says, because She's only a metaphor for childhood And a poem is a metaphor already So we'd only have a metaphor Inside a metaphor. Do you see? They all nod. They see. Except for the girl With her head in the rabbit hole. From this vantage, Her bum looks like the flattened backside Of a black and white panda. She actually has one In the crook of her arm. Of course it's stuffed and not living. Who would dare hold a real bear so near the outer ear? She's wondering what possible harm might come to her If she fell all the way down the dark she's looking through. Would strange creatures sing songs Where odd syllables came to a sibilant end at the end. Perhaps the sounds would be a form of light hissing. Like when a walrus blows air Through two fractured front teeth. Perhaps it would Take the form of a snake. But if a snake, it would need a tree. Could she grow one from seed? Could one make a cat? Make it sit on a branch and fade away again The moment you told it that the rude noise it was hearing was rational thought With an axe beating on the forest door.","['living', 'arts & sciences', 'philosophy', 'reading & books']",215,1099
philosophy,In Late August,Peter Campion,In a culvert by the airport under crumbling slag wine colored water seeps to this pool the two does drink from: each sipping as the other keeps look out. The skyline is a blur of barcode and microchip. Even at home we hold the narrowest purchase. No arcs of tracer fire. No caravans of fleeing families. Only this suspicion ripples through our circles of lamp glow (as you sweep the faint sweat from your forehead and flip another page in your novel) this sense that all we own is the invisible web of our words and touches silence and fabulation all make believe and real as the two does out scavenging through rose hips and shattered drywall: their presence in the space around them liveliest just before they vanish.,"['living', 'time & brevity', 'arts & sciences', 'philosophy', 'poetry & poets', 'reading & books']",129,719
philosophy,Passage,Rae Armantrout,"1 I held the framework of my life in mind with some precision. I knew when I was where — or where I was when — but not many incidents of my past had actually been preserved. Instead the frame served as a cargo cult runway, forever inviting the future to appear. I existed finally as the idea of temporal extension. 2 The creeper lineates the wall. Flowers as punctuation? Can you elaborate on the passage? Double meaning, superposition: hair standing on end makes a creature appear larger, more ferocious.","['living', 'growing old', 'midlife', 'time & brevity', 'arts & sciences', 'philosophy']",90,505
philosophy,Against Which,Michael Ryan,habit smacks its dull skull like a stuck bull in a brick stall and my version of what I know is like eye surgery with a backhoe on grace so much beyond my pitiful gray sponge of a brain I'd not believe it exists except for such doses of felicity as this.,"['arts & sciences', 'humor & satire', 'philosophy', 'sciences']",52,254
philosophy,[The happy ones are almost always also vulgar],Patrizia Cavalli,"The happy ones are almost always also vulgar; happiness has a way of thinking that's rushed and has no time to look but keeps on moving, compact and manic, with contempt in passing for the dying: Get on with your life, come on, buck up! Those stilled by pain don't mix with the cheerful, self-assured runners but with those who walk at the same slow pace. If one wheel locks and the other's turning the turning one doesn't stop turning but goes as far as it can, dragging the other in a poor, skewed race until the cart either comes to a halt or falls apart.","['living', 'growing old', 'time & brevity', 'arts & sciences', 'humor & satire', 'philosophy']",106,558
philosophy,At the Circus,Umberto Fiori,"At the center of the lit circle, rising from cotton-candy calf muscles, the White Clown ushers his eyebrows skyward. He grates his ukulele, opens a heart-shaped mouth, inhales— his serenade begins. Now's the time. From the shadows, a blast like a trumpeting elephant: obscene, ragged. The Auguste capers like a fawn, darts away, pads around with his trombone. The gold of the slide slips into and out of the infinite. Everything smells of panther and piss and mint. His gaze fixed on the clash between the welled tears and the awful laughing shoes, the little boy grows ever more grave, ever more severe.","['living', 'coming of age', 'philosophy']",103,604
philosophy,Slide,Umberto Fiori,"A playground, in a park. One lady raises to the top of the slide a ball of newspaper, gives it a kiss: ""Ready . . . set . . . go!"" Another holds a lampshade in her hands, smoothing its chenille bangs. ""My daughter, you should see her dance— she's already won two prizes."" ""Did I tell you mine—he's three—can already write?"" A girl, in line behind them with her son, is listening. She tightens her grip on his hand, hoping no one will notice he's real, and alive.","['living', 'parenthood', 'philosophy']",89,462
philosophy,Made to Measure,Stephen Edgar,"Impossible to wield The acreage of the fabric that unfolded, Slung from his shoulders like a crumpled field: The distance from one Christmas to the next When he was only seven Was aching there; a foreign city flexed Among the ripples; a face, the star-shocked heaven About his flailing arms were shrugged and moulded. Too heavy to outrun, Too slow to measure what it underwent, Though gradually the passage of the sun, Unmanageable in its train of light, Seemed almost to respond As he yanked the yards of stuff in like a kite And gathered the brocade that trailed beyond His arms' reach to the scale of measurement, However strange the weave That writhed about the working of his hands: The footage too atrocious to believe, Printed with corpses; Greece; the falls of salmon; Her upturned silken wrist He would have torn out history to examine; His father's final blessing, which he missed. However far he comes or where he stands, At last, and limb by limb, Contour by contour, that unfolded cape Settles ever more fittingly on him. His forehead is the line of the sky's vault, His shoulders trace the ground, His palms the ways he wandered by default, And in his gestures those he knew are found. What shape the day discovers is his shape.","['living', 'philosophy']",218,1242
philosophy,From the Towers,Heather McHugh,"Insanity is not a want of reason. It is reason's overgrowth, a calculating kudzu. Explaining why, in two-ton manifesti, thinkers sally forth with testaments and pipe bombs. Heaven help us: spare us all your meaningful designs. Shine down or shower forth, but (for the earthling's sake) ignore all prayers followed by against, or for. Teach us to bear life's senselessness, our insignificance, and more; let's call that sanity. The terrifying prospect isn't some escapist with a novel, fond of comfort, munching sweets— it is the busy hermeneut, so serious he's sour, intent on making meaning of us all, and bursting from the towers to the streets.","['living', 'arts & sciences', 'philosophy']",106,647
philosophy,Philosopher Orders Crispy Pork,Heather McHugh,"I love him so, this creature I do pray was treated kindly. I will pay as much as pig-lovers see fit to guarantee him that. As for his fat, I’d give up years yes years of my own life for such a gulpable semblable. (My life! Such as it is! This liberality of leaves! The world won’t need those seventeen more poems, after all, there being so few subjects to be treated. Three if by subject we mean anyone submitted to another’s will. Two if by subject we mean topic. One if by death we wind up meaning love. And none if a subject must entail the curlicue’s indulgence of itself.)","['activities', 'eating & drinking', 'arts & sciences', 'humor & satire', 'philosophy', 'poetry & poets']",111,577
philosophy,On Wanting to Tell [ ] about a Girl Eating Fish Eyes,Mary Szybist,"—how her loose curls float above each silver fish as she leans in to pluck its eyes— You died just hours ago. Not suddenly, no. You'd been dying so long nothing looked like itself: from your window, fishermen swirled sequins; fishnets entangled the moon. Now the dark rain looks like dark rain. Only the wine shimmers with candlelight. I refill the glasses and we raise a toast to you as so and so's daughter—elfin, jittery as a sparrow— slides into another lap to eat another pair of slippery eyes with her soft fingers, fingers rosier each time, for being chewed a little. If only I could go to you, revive you. You must be a little alive still. I'd like to put this girl in your lap. She's almost feverishly warm and she weighs hardly anything. I want to show you how she relishes each eye, to show you her greed for them. She is placing one on her tongue, bright as a polished coin— What do they taste like? I ask. Twisting in my lap, she leans back sleepily. They taste like eyes, she says.","['living', 'activities', 'eating & drinking', 'philosophy', 'horror']",186,995
philosophy,The Young,Roddy Lumsden,"You bastards! It’s all sherbet, and folly makes you laugh like mules. Chances dance off your wrists, each day ready, sprites in your bones and spite not yet swollen, not yet set. You gather handful after miracle handful, seeing straight, reaching the lighthouse in record time, pockets brim with scimitar things. Now is not a pinpoint but a sprawling realm. Bewilderment and thrill are whip-quick twins, carried on your backs, each vow new to touch and each mistake a broken biscuit. I was you. Sea robber boarding the won galleon. Roaring trees. Machines without levers, easy in bowel and lung. One cartwheel over the quicksand curve of Tuesday to Tuesday and you’re gone, summering, a ship on the farthest wave.","['living', 'activities', 'jobs & working', 'travels & journeys', 'philosophy']",120,713
philosophy,ROYGBIV,Fred D'Aguiar,"The shoemaker’s wife ran preschool With a fist made not so much of iron But wire bristles on a wooden brush. She made us recite and learn by rote. Our trick was to mouth words, sound As if we knew what we would one day Come to know, what would dawn On us as sure as a centipede knows What to do with its myriad legs. She made us settle our feet on the mud Floor of her daub and wattle hut and she Wielded a cane cut from wood that bit Into the palm of the hand and left a burn That resonated up the arm for an age After its smart swing and crisp contact. Worst of all was the shoe cupboard Where the old man stored his wire Brushes: a cold, dark, narrow place, Replete with brushes hung on nails Covering every square inch and said To come alive when a child was locked In with them so that they scrubbed Flesh off that child’s bones. She said We would end up there if we did not Concentrate, so we stilled our feet And spoke the words in the right order For colors in a rainbow until the very Thing took her place in front of us Arranged in cuneiform, polished, Brandishing a window to climb out.","['living', 'activities', 'school & learning', 'philosophy']",220,1097
philosophy,Sonnet of the Seven Chinese,Franco Fortini,"The Augsburg poet once said he had tacked an image of the Man of Doubt to the wall of his room. A Chinese print. The image asked: how ought one to act? I have a photo on my wall. Twenty years ago seven Chinese workers looked into my lens. They look wary or ironic or tense. They know I do not write for them. I know they didn’t live for me. Yet sometimes I feel I’m being asked for more candid words, more credible deeds, by their doubtfulness. In turn I ask their help in making visible the contradictions and identities among us. If there’s a point, it’s this.","['arts & sciences', 'philosophy']",109,562
philosophy,from Light: “I always thought reality”,Inger Christensen,"I always thought reality was something you became when you grew up. In the square stands Fata Morgana looking tired, shouting Morning paper—morning paper.","['living', 'growing old', 'time & brevity', 'philosophy', 'social commentaries', 'cities & urban life']",24,154
philosophy,At the Galleria Shopping Mall,Tony Hoagland,"Just past the bin of pastel baby socks and underwear,there are some","['living', 'philosophy', 'social commentaries', 'money & economics', 'popular culture']",12,67
philosophy,Another Road Home,Scott Cairns,After Stevens It was when he said expansively There is no such thing as the truth,"['parenthood', 'arts & sciences', 'philosophy']",16,81
philosophy,Teeth,Kevin McFadden,"For knowledge, says the Old Sage, add; for wisdom,subtract. My head in a surgeon’s chair, checking Lao Tsu’s math as these teeth I barely knew I had (mumbled of as wisdom) introducedthemselves—rude party guests—right as they hadto go, their pinched","['living', 'coming of age', 'arts & sciences', 'philosophy']",40,248
philosophy,Museums,Dan Beachy-Quick,"Must I, in this question I am asking, include myselfAsking it? Must I include my face—My face that I cannot see—through which I speakThis question about my eyes, about the fieldOf vision, in which my hands press down these lettersUnattached to my arms? The sunlightComes in the window and lights up my handsAs they work. The world is not being kindBut there is the sensation of kindness. There is an appeal to a rule when we realize a termBehaves uncomfortably. God falls down Into grammar and says","['arts & sciences', 'philosophy', 'poetry & poets']",87,498
philosophy,Cast Off,Belle Randall,"If thy own hand . . . offend thee —Matthew 18:8 Self-hatred? No, no dear: that seems inflated—chagrin: the shame you feel when friends withdrawfor reasons they leave tactfully unstated,leaving you to guess at your faux pasFrom all you did and didn’t say for ages,as in some vast congressional report,your sin, at last, is lost among the pages;a snow of detail cuts inquiry short.In downtown windows where late sunlight glares,you see yourself, as if you’d never met.Who is this rumpled lookalike who wearsa blouse like yours, the armpits dark with sweat?Your eighth grade diary still makes you cringesaved—for what?—that you might now despisepages time has lent a jaundiced tingepouring forth their daisy-dotted","['living', 'midlife', 'time & brevity', 'humor & satire', 'philosophy']",112,711
philosophy,Language is her caravan,Caleb Klaces,"Frosty, green through gray rising steeply,top of the bank a big top, red with a sign,misty, fantastical on the walk to school.“My sister can’t express herself properly. Imagine if those performerswere stuck in their caravansforever. If round the back of the big topthe doors were locked. That’s her.She’s a trapeze artist, lion tamer,cramped clean-faced clowndrinking tea, practicing tricks,movement through frosted windows.Language is her caravan on bricks,with tiny little windows in.”At the weekend he and his sisterstood on the frosty bankbeside his metaphor. She read the postercarefully, got them sat down in good time and at the back.The trapeze artist, lion tamer, freshly-made-up clownfilled the top with a noise he could go on translating forever.Walking home she opened her chest:“I liked the mime best.”","['living', 'disappointment & failure', 'family & ancestors', 'philosophy']",123,815
philosophy,Living at the End of Time,Robert Bly,"There is so much sweetness in children’s voices,And so much discontent at the end of day,And so much satisfaction when a train goes by.I don’t know why the rooster keeps crying,Nor why elephants keep raising their trunks,Nor why Hawthorne kept hearing trains at night.A handsome child is a gift from God,And a friend is a vein in the back of the hand,And a wound is an inheritance from the wind.Some say we are living at the end of time,But I believe a thousand pagan ministersWill arrive tomorrow to baptize the wind.There’s nothing we need to do about John. The BaptistHas been laying his hands on earth for so longThat the well water is sweet for a hundred miles.It’s all right if we don’t know what the roosterIs saying in the middle of the night, nor why we feelSo much satisfaction when a train goes by.","['living', 'time & brevity', 'arts & sciences', 'philosophy']",145,809
philosophy,Journey,Gerald Stern,"How dumb he was to wipe the blood from his eyewhere he was sucker-punched and stagger outonto the Plaza blind. He had been waitingall night for the acorn moon and eating pineappletopping over his ice cream and arguingeither physics or philosophy. He thinks,at this late date, it was the cave againthrowing a shadow, although it may have beenonly some way of reconciling the two oblivious worlds, which was his mission anyhow—if only there was a second moon. He had a kind of beard and though he could practically liftthe front end of a car and was alreadyreading Blake, he had never yet tasted honey.","['living', 'coming of age', 'arts & sciences', 'philosophy']",104,600
philosophy,Testament,Connie Voisine,"The cat wants to be a strong thing—a hand, a tree. The girl wants to be a pirate, in a tree. The tree wants to be the pond with its face of shining. The pond wants to be the sun who dumps its sugar on the grass. The grass wants to be the foot, its sole, its heel. The foot wants to be the brain who always gets to choose. The brain wants to be the feet dumb in their shoes.The shoe wants to be the buckle that the girl shines with a cloth. The buckle wants to be the magpie lifting what shines. The magpie wants to be the egg in the nest touching its brother. The egg wants to be the feather. The feather wants to be the mite, devouring its plume.","['the body', 'nature', 'animals', 'trees & flowers', 'arts & sciences', 'philosophy']",134,647
